show_id,type,title,country,date_added,release_year,rating,duration,listed_in
80125627,Movie,Rustom,India,06/01/2017,2016,TV-14,141 min,"Dramas, International Movies"
81037970,Movie,3 Heroines,Indonesia,05/01/2019,2016,TV-PG,124 min,"Dramas, International Movies, Sports Movies"
81037984,Movie,5 Cowok Jagoan,,05/01/2019,2017,TV-MA,106 min,"Action & Adventure, Comedies, International Movies"
81037986,Movie,Chaotic Love Poems,Indonesia,05/01/2019,2016,TV-14,86 min,"Dramas, International Movies, Romantic Movies"
81037985,Movie,Love You... Love You Not,Indonesia,05/01/2019,2015,TV-14,115 min,"Comedies, International Movies, Romantic Movies"
80153895,Movie,Mara,United Kingdom,05/01/2019,2017,TV-MA,99 min,"Horror Movies, Thrillers"
70026431,Movie,Nang Nak,Thailand,05/01/2019,1999,TV-14,101 min,"Horror Movies, International Movies, Romantic Movies"
80020885,Movie,Soekarno,Indonesia,05/01/2019,2013,TV-MA,142 min,"Dramas, International Movies"
80002667,Movie,Before I Wake,United States,05/01/2018,2016,PG-13,97 min,"Horror Movies, Thrillers"
80174974,TV Show,Devilman Crybaby,Japan,05/01/2018,2018,TV-MA,1 Season,"Anime Series, International TV Shows, TV Horror"
80213400,Movie,Don Quixote: The Ingenious Gentleman of La Mancha,United States,05/01/2018,2015,TV-14,83 min,"Comedies, Independent Movies"
80148595,Movie,Back and Forth,Brazil,05/01/2017,2016,NR,95 min,"Comedies, Dramas, International Movies"
70301484,Movie,Kraftidioten,"Norway, Denmark, Sweden",05/01/2017,2014,TV-MA,117 min,"Comedies, International Movies, Thrillers"
80038358,Movie,Rampage: President Down,Canada,05/01/2017,2016,TV-MA,100 min,"Action & Adventure, International Movies"
80997687,TV Show,Dracula,United Kingdom,04/01/2020,2020,TV-14,1 Season,"British TV Shows, International TV Shows, TV Dramas"
80237347,TV Show,Go! Go! Cory Carson,United States,04/01/2020,2020,TV-Y,1 Season,Kids' TV
80998427,Movie,And Breathe Normally,"Iceland, Sweden, Belgium",04/01/2019,2018,TV-14,102 min,"Dramas, Independent Movies, International Movies"
80090370,TV Show,Case Closed,Japan,04/01/2019,2015,TV-14,1 Season,"Anime Series, Crime TV Shows, TV Thrillers"
81000860,Movie,El Potro: Unstoppable,,04/01/2019,2018,TV-MA,122 min,"Dramas, International Movies, Music & Musicals"
81030789,Movie,Lionheart,Nigeria,04/01/2019,2018,TV-PG,95 min,"Comedies, Dramas, Independent Movies"
81020635,TV Show,See You in Time,,04/01/2019,2017,TV-14,1 Season,"International TV Shows, Romantic TV Shows, TV Dramas"
80134893,Movie,Marvel's Hulk: Where Monsters Dwell,United States,04/01/2017,2016,PG,75 min,"Children & Family Movies, Sci-Fi & Fantasy"
81047683,Movie,Agatha and the Truth of Murder,United Kingdom,31/01/2019,2018,TV-14,92 min,Dramas
81034697,TV Show,Crime Time,France,31/01/2019,2017,TV-MA,1 Season,"Crime TV Shows, International TV Shows, TV Action & Adventure"
81049950,Movie,Hantu Kak Limah,Malaysia,31/01/2019,2018,TV-14,110 min,"Comedies, Horror Movies, International Movies"
81047677,Movie,I Dream Of Dance,,31/01/2019,2017,TV-PG,106 min,"Children & Family Movies, Documentaries"
80188596,Movie,Love Off the Cuff,"China, Hong Kong",31/01/2019,2017,TV-MA,120 min,"Comedies, Dramas, International Movies"
80189656,TV Show,Paprika,,31/01/2019,2018,TV-Y,1 Season,Kids' TV
81016360,Movie,The Gentleman Driver,United States,31/01/2019,2018,TV-MA,83 min,"Documentaries, Sports Movies"
70307659,Movie,The Hundred-Foot Journey,"United States, India, United Arab Emirates",31/01/2019,2014,PG,123 min,"Comedies, Dramas"
80224476,Movie,Expedition Happiness,Germany,31/01/2018,2017,TV-PG,96 min,"Documentaries, International Movies"
80133549,Movie,Bill Burr: Walk Your Way Out,United States,31/01/2017,2017,TV-MA,78 min,Stand-Up Comedy
80081958,Movie,Semana Santa,Mexico,31/01/2017,2015,NR,87 min,"Dramas, International Movies"
81035398,Movie,Maharaja: The Story of Ranjit Singh,,30/01/2019,2010,TV-14,56 min,"Dramas, International Movies"
70113347,Movie,Sat Sri Akal,India,30/01/2019,2008,TV-PG,141 min,"Dramas, Faith & Spirituality, International Movies"
80097389,Movie,Swiss Army Man,"United States, Sweden",30/01/2019,2016,R,97 min,"Comedies, Dramas, Independent Movies"
80221639,Movie,The Incredibles 2,United States,30/01/2019,2018,PG,118 min,"Children & Family Movies, Comedies"
70099120,Movie,The Longshots,United States,30/01/2019,2008,PG,95 min,"Comedies, Dramas, Sports Movies"
81024718,Movie,Virsa,"India, Pakistan",30/01/2019,2010,TV-14,127 min,"Dramas, International Movies, Music & Musicals"
21028726,Movie,Jerry Seinfeld: I'm Telling You for the Last Time,United States,30/01/2018,1998,TV-G,69 min,Stand-Up Comedy
80019930,Movie,Monster High: Freaky Fusion,United States,30/01/2018,2014,TV-Y7,74 min,Children & Family Movies
80141960,TV Show,Retribution,United Kingdom,30/01/2018,2016,TV-MA,1 Season,"British TV Shows, Crime TV Shows, International TV Shows"
80226168,TV Show,The Lady in Dignity,South Korea,30/01/2018,2017,TV-MA,1 Season,"International TV Shows, Korean TV Shows, TV Dramas"
81006825,Movie,All the Freckles in the World,Mexico,03/01/2020,2020,TV-14,90 min,"Comedies, International Movies, Romantic Movies"
81213891,Movie,Deewangee,India,03/01/2020,2002,TV-MA,156 min,"International Movies, Thrillers"
498716,Movie,Ferris Bueller's Day Off,United States,03/01/2020,1986,PG-13,103 min,"Classic Movies, Comedies, Cult Movies"
80220085,Movie,Occupation,Australia,03/01/2019,2018,R,120 min,"Action & Adventure, Sci-Fi & Fantasy"
80244855,Movie,Pope Francis: A Man of His Word,"Switzerland, Vatican City, Italy, Germany, France",03/01/2019,2018,PG,96 min,"Documentaries, Faith & Spirituality, International Movies"
80134966,Movie,Jen Kirkman: Just Keep Livin’?,United States,03/01/2017,2017,TV-MA,69 min,Stand-Up Comedy
80220813,Movie,Ant-Man and the Wasp,United States,29/01/2019,2018,PG-13,118 min,"Action & Adventure, Comedies, Sci-Fi & Fantasy"
81048561,Movie,Bhasmasur,India,29/01/2019,2017,TV-14,74 min,"Dramas, Independent Movies, International Movies"
80237903,Movie,"Gabriel ""Fluffy"" Iglesias: One Show Fits All",,29/01/2019,2019,TV-14,91 min,Stand-Up Comedy
81026705,Movie,High Society,South Korea,29/01/2019,2018,TV-MA,137 min,"Dramas, International Movies"
80244929,TV Show,Inside the Mossad,Israel,29/01/2019,2017,TV-14,1 Season,"Docuseries, International TV Shows"
80122209,Movie,Up Among  The Stars,Spain,29/01/2019,2018,TV-MA,86 min,"Dramas, International Movies, Sci-Fi & Fantasy"
80109193,Movie,Holy Camp!,Spain,29/01/2018,2017,TV-14,108 min,"Comedies, Dramas, Faith & Spirituality"
80208468,Movie,Hostages,,29/01/2018,2017,TV-MA,91 min,"Documentaries, International Movies"
80214582,Movie,Patient Seventeen,United States,29/01/2018,2017,TV-14,68 min,Documentaries
80168198,Movie,The Force,United States,29/01/2018,2017,TV-MA,92 min,Documentaries
80117940,Movie,Journey to Greenland,France,29/01/2017,2016,TV-14,99 min,"Comedies, International Movies"
80998786,Movie,Alt-Right: Age of Rage,,28/01/2019,2018,TV-MA,106 min,Documentaries
81047898,Movie,Habibie & Ainun,"Indonesia, Singapore",28/01/2019,2012,TV-14,125 min,"Dramas, International Movies, Romantic Movies"
81057249,Movie,Nathicharami,India,28/01/2019,2018,TV-14,114 min,"Dramas, Independent Movies, International Movies"
81047900,Movie,Rudy Habibie,Indonesia,28/01/2019,2016,TV-14,143 min,"Dramas, International Movies"
81047899,Movie,Surga Yang Tak Dirindukan,Indonesia,28/01/2019,2015,TV-14,121 min,"Dramas, Faith & Spirituality, International Movies"
81047901,Movie,Surga Yang Tak Dirindukan 2,Indonesia,28/01/2019,2017,TV-14,119 min,"Dramas, Faith & Spirituality, International Movies"
70261978,TV Show,Frozen Planet,"United Kingdom, United States, Spain, Germany, Greece, Canada",28/01/2016,2011,TV-PG,1 Season,"British TV Shows, Docuseries, International TV Shows"
70279637,Movie,Frozen Planet: On Thin Ice,"United Kingdom, United States, Spain, Germany, Greece, Canada",28/01/2016,2011,TV-PG,47 min,Movies
80049171,Movie,Frozen Planet: The Epic Journey,"United Kingdom, United States, Spain, Germany, Greece, Canada",28/01/2016,2011,TV-PG,52 min,Movies
80048250,TV Show,The Making of Frozen Planet,"United Kingdom, United States, Spain, Germany, Greece, Canada",28/01/2016,2012,TV-PG,1 Season,"British TV Shows, Docuseries, Science & Nature TV"
80189619,TV Show,A Taiwanese Tale of Two Cities,,27/01/2019,2018,TV-MA,1 Season,"International TV Shows, TV Dramas"
80099016,Movie,IBOY,United Kingdom,27/01/2017,2017,TV-MA,91 min,"International Movies, Sci-Fi & Fantasy, Thrillers"
80123792,TV Show,Juana Inés,Mexico,27/01/2017,2016,TV-14,1 Season,"International TV Shows, Spanish-Language TV Shows, TV Dramas"
80132792,TV Show,Shadow of Truth,Israel,27/01/2017,2016,TV-MA,1 Season,"Crime TV Shows, Docuseries, International TV Shows"
60024962,Movie,Biggie & Tupac,United Kingdom,26/01/2019,2002,R,108 min,"Documentaries, Music & Musicals"
81031181,Movie,Goyo: The Boy General,Philippines,26/01/2019,2018,TV-MA,150 min,"Dramas, International Movies"
80107084,Movie,A Futile and Stupid Gesture,United States,26/01/2018,2018,TV-MA,102 min,Comedies
80118100,TV Show,Dirty Money,United States,26/01/2018,2018,TV-14,1 Season,"Crime TV Shows, Docuseries"
80196589,Movie,Fakkah Fuzz: Almost Banned,Singapore,26/01/2018,2018,TV-MA,61 min,Stand-Up Comedy
80183089,Movie,Mau Nieto: Viviendo sobrio… desde el bar,Mexico,26/01/2018,2018,TV-MA,57 min,Stand-Up Comedy
80125818,Movie,Mune: Guardian of the Moon,France,26/01/2018,2014,PG,85 min,Children & Family Movies
80192138,Movie,Sebastián Marcelo Wainraich,Argentina,26/01/2018,2018,TV-MA,49 min,Stand-Up Comedy
80169801,Movie,13TH: A Conversation with Oprah Winfrey & Ava DuVernay,,26/01/2017,2017,,37 min,Movies
80239629,Movie,Animas,"Spain, Belgium",25/01/2019,2018,TV-MA,88 min,"Horror Movies, International Movies"
80145141,TV Show,Black Earth Rising,United Kingdom,25/01/2019,2018,TV-MA,1 Season,"British TV Shows, International TV Shows, TV Dramas"
80991879,TV Show,Examination of Conscience,Spain,25/01/2019,2019,TV-MA,1 Season,"Crime TV Shows, Docuseries, International TV Shows"
80180171,TV Show,Kingdom,"South Korea, United States",25/01/2019,2019,TV-MA,1 Season,"International TV Shows, Korean TV Shows, TV Action & Adventure"
81023638,Movie,Mi Obra Maestra,"Argentina, Spain",25/01/2019,2018,TV-MA,105 min,"Comedies, International Movies"
80223052,Movie,Polar,"United States, Germany",25/01/2019,2019,TV-MA,119 min,"Action & Adventure, International Movies"
81020577,TV Show,The Perfect Match,,25/01/2019,2017,TV-14,1 Season,"International TV Shows, Romantic TV Shows, TV Comedies"
80190283,Movie,Acts of Vengeance,"Bulgaria, United States",25/01/2018,2017,R,87 min,"Action & Adventure, International Movies"
80148920,Movie,O Silêncio do Céu,Brazil,25/01/2017,2016,TV-MA,102 min,"Dramas, International Movies"
80226612,TV Show,Conversations with a Killer: The Ted Bundy Tapes,United States,24/01/2019,2019,TV-MA,1 Season,"Crime TV Shows, Docuseries"
80233925,Movie,Hotel Transylvania 3: Summer Vacation,United States,24/01/2019,2018,PG,97 min,"Children & Family Movies, Comedies"
81021098,Movie,Just Love,Argentina,24/01/2019,2018,TV-MA,96 min,"Dramas, International Movies, Music & Musicals"
80194737,Movie,Blockbuster,France,24/01/2018,2017,TV-MA,85 min,"Comedies, Independent Movies, International Movies"
80214406,TV Show,Prison Playbook,South Korea,24/01/2018,2017,TV-MA,1 Season,"International TV Shows, Korean TV Shows, TV Comedies"
80192062,Movie,Ricardo Quevedo: Hay gente así,Colombia,24/01/2018,2018,TV-MA,59 min,Stand-Up Comedy
80193614,Movie,The Good Catholic,United States,24/01/2018,2017,PG-13,97 min,"Comedies, Dramas, Romantic Movies"
80117453,Movie,Cristela Alonzo: Lower Classy,United States,24/01/2017,2017,TV-MA,67 min,Stand-Up Comedy
70296733,Movie,Mitt,United States,24/01/2014,2014,TV-PG,93 min,Documentaries
81026192,TV Show,Innocent,Turkey,23/01/2019,2017,TV-MA,1 Season,"Crime TV Shows, International TV Shows, TV Dramas"
70109891,Movie,Planet 51,"Spain, United Kingdom, United States",23/01/2019,2009,PG,91 min,"Children & Family Movies, Comedies, Sci-Fi & Fantasy"
80003479,Movie,Iceman,"China, Hong Kong",23/01/2018,2014,R,104 min,"Action & Adventure, International Movies, Sci-Fi & Fantasy"
80163053,Movie,My Entire High School Sinking Into the Sea,United States,23/01/2018,2016,PG-13,77 min,"Comedies, Independent Movies"
80208684,Movie,Todd Glass: Act Happy,United States,23/01/2018,2018,TV-MA,63 min,Stand-Up Comedy
80124680,Movie,Gad Gone Wild,France,23/01/2017,2017,TV-MA,57 min,Stand-Up Comedy
80073486,TV Show,Chelsea Does,United States,23/01/2016,2016,TV-MA,1 Season,"Docuseries, Science & Nature TV"
70302480,Movie,Iliza Shlesinger: Freezing Hot,,23/01/2015,2015,TV-MA,72 min,Stand-Up Comedy
80175405,Movie,Countdown to Death: Pablo Escobar,,22/01/2018,2017,TV-MA,69 min,"Documentaries, International Movies"
80175290,TV Show,The Traffickers,United States,22/01/2018,2016,TV-MA,1 Season,"Crime TV Shows, Docuseries"
80214777,Movie,Where's the Money,United States,22/01/2018,2017,R,86 min,Comedies
80079427,Movie,Ricardo O'Farrill Abrazo Genial,Mexico,22/01/2016,2016,TV-MA,92 min,Stand-Up Comedy
81026986,TV Show,Justice,United Arab Emirates,21/01/2019,2018,TV-14,1 Season,"Crime TV Shows, International TV Shows, TV Dramas"
80216146,TV Show,Love and Hong Kong,Japan,20/01/2018,2017,TV-14,1 Season,"International TV Shows, Romantic TV Shows, TV Dramas"
80149575,Movie,Caida del Cielo,Argentina,20/01/2017,2016,NR,78 min,"Comedies, International Movies, Romantic Movies"
80144448,Movie,Pink,India,20/01/2017,2016,NR,130 min,"Dramas, International Movies"
80100936,Movie,Take the 10,United States,20/01/2017,2017,TV-MA,80 min,Comedies
80192420,Movie,Half Girlfriend,India,02/01/2020,2017,TV-PG,129 min,"Dramas, International Movies, Romantic Movies"
81160763,TV Show,"Sex, Explained",United States,02/01/2020,2020,TV-MA,1 Season,"Docuseries, Science & Nature TV"
81054827,TV Show,Thieves of the Wood,Belgium,02/01/2020,2019,TV-MA,1 Season,"International TV Shows, TV Action & Adventure, TV Dramas"
81020692,TV Show,Déjà Vu,,02/01/2019,2013,TV-14,1 Season,"International TV Shows, Romantic TV Shows, TV Dramas"
771476,Movie,Monty Python and the Holy Grail,United Kingdom,02/01/2019,1975,PG,92 min,"Action & Adventure, Classic Movies, Comedies"
80213401,Movie,Haunters: The Art of the Scare,United States,02/01/2018,2017,TV-MA,89 min,"Documentaries, Horror Movies"
80198056,Movie,Mustang Island,United States,02/01/2018,2017,TV-14,86 min,"Comedies, Dramas, Independent Movies"
80208083,Movie,The Jack King Affair,France,02/01/2018,2015,TV-14,52 min,"Documentaries, International Movies"
80045818,Movie,Auschwitz: Blueprints of Genocide,United Kingdom,19/01/2019,1994,TV-PG,49 min,Documentaries
80195429,Movie,Harith Iskander: I Told You So,United States,19/01/2018,2018,TV-PG,62 min,Stand-Up Comedy
80158485,Movie,Step Sisters,United States,19/01/2018,2018,TV-14,108 min,Comedies
80198661,Movie,The Open House,United States,19/01/2018,2018,TV-MA,95 min,"Horror Movies, Thrillers"
80119375,Movie,Good Kids,United States,19/01/2017,2016,R,90 min,"Comedies, Independent Movies"
70271454,Movie,The Bling Ring,"United States, United Kingdom, France, Germany, Japan",18/01/2020,2013,R,91 min,"Dramas, Independent Movies"
80207371,Movie,Close,"United Kingdom, United States",18/01/2019,2019,TV-MA,95 min,"Action & Adventure, International Movies"
81035279,Movie,FYRE: The Greatest Party That Never Happened,United States,18/01/2019,2019,TV-MA,98 min,Documentaries
80134721,Movie,IO,United States,18/01/2019,2019,TV-14,96 min,"Dramas, Sci-Fi & Fantasy"
81041182,Movie,Lady-Like,United States,18/01/2019,2018,NC-17,83 min,"Comedies, Independent Movies"
81038575,TV Show,Legends of Strength,United States,18/01/2019,2017,TV-PG,1 Season,Docuseries
81020612,TV Show,Memory Love,,18/01/2019,2017,TV-14,1 Season,"International TV Shows, Romantic TV Shows, TV Dramas"
81038976,Movie,Old Lord Savanna,Brazil,18/01/2019,2018,TV-PG,96 min,"Documentaries, International Movies"
80988257,Movie,Patria,Mexico,18/01/2019,2019,TV-MA,90 min,"Documentaries, International Movies"
81023713,Movie,Soni,India,18/01/2019,2018,TV-MA,97 min,"Dramas, Independent Movies, International Movies"
81038583,TV Show,Strongland,,18/01/2019,2018,TV-PG,1 Season,"Docuseries, International TV Shows"
80144442,TV Show,Trigger Warning with Killer Mike,,18/01/2019,2019,TV-MA,1 Season,Docuseries
80174219,Movie,Bad Day for the Cut,United Kingdom,18/01/2018,2017,TV-MA,99 min,"Independent Movies, International Movies, Thrillers"
80215322,TV Show,Tiempos de guerra,Spain,18/01/2018,2017,TV-MA,1 Season,"International TV Shows, Romantic TV Shows, Spanish-Language TV Shows"
80133139,Movie,Enlighten Us,United States,18/01/2017,2016,TV-14,93 min,Documentaries
81127902,Movie,A Fall from Grace,,17/01/2020,2020,TV-MA,121 min,"Dramas, Thrillers"
80995039,TV Show,Ares,,17/01/2020,2020,TV-MA,1 Season,"International TV Shows, TV Dramas, TV Horror"
81062580,TV Show,Nailed It! Germany,,17/01/2020,2020,TV-14,1 Season,"International TV Shows, Reality TV"
80191988,Movie,Arango y Sanint: Ríase el show,Colombia,17/01/2018,2018,TV-MA,62 min,Stand-Up Comedy
80180373,TV Show,Godzilla,Japan,17/01/2018,2017,TV-14,1 Season,TV Shows
80117452,Movie,Neal Brennan: 3 Mics,United States,17/01/2017,2017,TV-MA,66 min,Stand-Up Comedy
80152003,Movie,Roger Corman's Death Race 2050,United States,17/01/2017,2017,R,93 min,"Action & Adventure, Sci-Fi & Fantasy"
80126875,TV Show,Şubat,Turkey,17/01/2017,2013,TV-14,1 Season,"Crime TV Shows, International TV Shows, TV Dramas"
70268449,Movie,The Square,"United Kingdom, Egypt, United States",17/01/2014,2013,TV-MA,105 min,"Documentaries, International Movies"
81147285,Movie,Deadcon,United States,16/01/2020,2019,TV-MA,78 min,Horror Movies
70120142,Movie,Get Him to the Greek,United States,16/01/2020,2010,R,109 min,"Comedies, Music & Musicals"
80996973,TV Show,Handsome Siblings,China,16/01/2020,2020,TV-14,1 Season,"International TV Shows, TV Dramas, TV Sci-Fi & Fantasy"
70142824,Movie,Hop,"United States, India, Malaysia, Taiwan, Canada, United Kingdom",16/01/2020,2011,PG,95 min,"Children & Family Movies, Comedies"
81235729,Movie,Jezebel,United States,16/01/2020,2019,TV-MA,86 min,"Dramas, Independent Movies"
80057599,Movie,Legend,"United Kingdom, France, United States",16/01/2020,2015,R,132 min,"Dramas, International Movies, Thrillers"
81093113,Movie,NiNoKuni,Japan,16/01/2020,2019,TV-14,107 min,"Action & Adventure, Anime Features, Children & Family Movies"
80049358,Movie,Steve Jobs,"United Kingdom, United States",16/01/2020,2015,R,122 min,Dramas
81050192,Movie,Driven to Dance,United States,16/01/2019,2018,TV-PG,99 min,Dramas
70141971,Movie,Skyline,United States,16/01/2019,2010,PG-13,94 min,"Action & Adventure, Sci-Fi & Fantasy"
70114021,Movie,A Serious Man,"United States, United Kingdom, France",16/01/2018,2009,R,106 min,"Comedies, Independent Movies"
70275751,Movie,Dallas Buyers Club,United States,16/01/2018,2013,R,117 min,"Dramas, Independent Movies, LGBTQ Movies"
80216224,Movie,Katt Williams: Great America,United States,16/01/2018,2018,TV-MA,60 min,Stand-Up Comedy
70098902,Movie,Flash of Genius,"Canada, United States",16/01/2017,2008,PG-13,119 min,Dramas
80118718,Movie,The Rezort,"United Kingdom, Spain, Belgium",16/01/2017,2016,TV-MA,90 min,"Horror Movies, International Movies"
60022265,Movie,Big Fat Liar,"United States, Germany",15/01/2020,2002,PG,88 min,"Children & Family Movies, Comedies"
81026003,Movie,Bulbul Can Sing,India,15/01/2020,2018,TV-14,95 min,"Dramas, Independent Movies, International Movies"
80997602,Movie,Eye For An Eye,Spain,15/01/2020,2019,TV-MA,108 min,"Dramas, International Movies, Thrillers"
81062828,TV Show,Killer Inside: The Mind of Aaron Hernandez,United States,15/01/2020,2020,TV-MA,1 Season,"Crime TV Shows, Docuseries"
80169611,Movie,MindGamers,Austria,15/01/2020,2017,R,99 min,"International Movies, Sci-Fi & Fantasy, Thrillers"
81144867,Movie,Saving Zoë,United States,15/01/2020,2019,R,95 min,Dramas
81127333,Movie,The Brave,United States,15/01/2020,2019,TV-MA,103 min,"Action & Adventure, Independent Movies"
60000878,Movie,Where the Money Is,"Germany, United States, United Kingdom, Canada",15/01/2020,2000,PG-13,89 min,"Action & Adventure, Comedies, Dramas"
81000864,Movie,Abducted in Plain Sight,United States,15/01/2019,2017,TV-14,90 min,Documentaries
81047445,Movie,"Abdullah, The Final Witness",Pakistan,15/01/2019,2016,TV-14,88 min,"Dramas, International Movies"
81052265,Movie,Adhugo,India,15/01/2019,2018,TV-14,105 min,"Comedies, International Movies, Thrillers"
81045085,Movie,Chupan Chupai,Pakistan,15/01/2019,2017,TV-14,118 min,"Comedies, International Movies"
81050190,Movie,Deadly Switch,United States,15/01/2019,2019,TV-PG,86 min,"Independent Movies, Thrillers"
81045065,Movie,Echcharikkai,India,15/01/2019,2018,TV-14,127 min,"International Movies, Thrillers"
70205712,TV Show,La Rosa de Guadalupe,Mexico,15/01/2019,2010,TV-PG,1 Season,"Classic & Cult TV, Crime TV Shows, International TV Shows"
80028965,TV Show,La Viuda Negra,"Colombia, Mexico, United States",15/01/2019,2016,TV-14,1 Season,"Crime TV Shows, International TV Shows, Spanish-Language TV Shows"
81020716,TV Show,Lavender,Taiwan,15/01/2019,2002,TV-14,1 Season,"International TV Shows, Romantic TV Shows, TV Dramas"
81050191,Movie,Only Mine,United States,15/01/2019,2018,TV-14,88 min,Thrillers
80202078,Movie,Pandigai,India,15/01/2019,2017,TV-14,125 min,"Action & Adventure, Dramas, International Movies"
81047446,Movie,Pari,Pakistan,15/01/2019,2018,TV-14,116 min,"Horror Movies, International Movies"
81000511,Movie,Revenger,South Korea,15/01/2019,2018,TV-MA,102 min,"Action & Adventure, International Movies"
80218104,Movie,Sebastian Maniscalco: Stay Hungry,United States,15/01/2019,2019,TV-MA,65 min,Stand-Up Comedy
80997719,Movie,The Devil We Know,United States,15/01/2019,2018,TV-14,88 min,Documentaries
81044856,Movie,The Doll,Indonesia,15/01/2019,2016,TV-MA,106 min,"Horror Movies, International Movies"
81044857,Movie,The Doll 2,Indonesia,15/01/2019,2017,TV-MA,117 min,"Horror Movies, International Movies"
80154682,Movie,A Boy Called Po,United States,15/01/2018,2016,PG,94 min,"Dramas, Sci-Fi & Fantasy"
80158543,Movie,Alibaba Aur 40 Chor,"Soviet Union, India",15/01/2018,1980,TV-PG,147 min,"Action & Adventure, International Movies, Sci-Fi & Fantasy"
80216543,Movie,Down The Fence,United States,15/01/2018,2017,TV-PG,94 min,Documentaries
80223136,Movie,Face 2 Face,United States,15/01/2018,2017,TV-MA,89 min,"Dramas, Independent Movies"
80189955,Movie,Manolo: The Boy Who Made Shoes for Lizards,United Kingdom,15/01/2018,2017,TV-MA,89 min,"Documentaries, International Movies"
80195807,Movie,One More Shot,United States,15/01/2018,2017,TV-MA,89 min,Documentaries
80116307,Movie,Operation Chromite,South Korea,15/01/2018,2016,NR,111 min,"Action & Adventure, Dramas, International Movies"
80228321,Movie,Phir Se,India,15/01/2018,2015,TV-14,118 min,"International Movies, Romantic Movies"
80156940,Movie,Pyar Ke Do Pal,India,15/01/2018,1986,TV-PG,153 min,"Dramas, International Movies, Music & Musicals"
80222177,Movie,Rip Tide,"Australia, United Arab Emirates",15/01/2018,2017,TV-Y7,87 min,"Children & Family Movies, Dramas, Sports Movies"
80224233,Movie,Thong Dee Fun Khao,Thailand,15/01/2018,2017,TV-MA,122 min,"Action & Adventure, International Movies, Sports Movies"
80168300,Movie,Unrest,"United Kingdom, United States",15/01/2018,2017,TV-14,97 min,Documentaries
80228282,Movie,Urvi,India,15/01/2018,2017,TV-MA,121 min,"Dramas, Independent Movies, International Movies"
70114977,Movie,Berlin Calling,Germany,15/01/2017,2008,NR,105 min,"Dramas, International Movies, Music & Musicals"
80105342,Movie,Harry and Snowman,United States,15/01/2017,2015,TV-PG,83 min,"Documentaries, Sports Movies"
80119140,Movie,Hostage to the Devil,"Ireland, United Kingdom, Italy, United States",15/01/2017,2016,TV-14,96 min,"Documentaries, International Movies"
70285683,Movie,Max Rose,United States,15/01/2017,2013,TV-14,84 min,"Dramas, Independent Movies"
80141338,Movie,Sarajevo,"Austria, Czech Republic",15/01/2017,2014,NR,98 min,"Dramas, International Movies"
80015154,Movie,Stereo,Germany,15/01/2017,2014,TV-MA,91 min,"International Movies, Thrillers"
80106440,Movie,Teenage Cocktail,United States,15/01/2017,2016,TV-MA,89 min,"Dramas, Independent Movies, LGBTQ Movies"
80128690,Movie,The Similars,Mexico,15/01/2017,2015,NR,90 min,"Horror Movies, Independent Movies, International Movies"
80156769,Movie,"Twisted Trunk, Big Fat Body",India,15/01/2017,2015,TV-14,89 min,"Dramas, International Movies"
80141337,Movie,We Are Young. We Are Strong.,Germany,15/01/2017,2014,NR,123 min,"Dramas, International Movies"
70118799,Movie,Ip Man,"Hong Kong, China",15/01/2016,2008,R,107 min,"Action & Adventure, Dramas, International Movies"
70137753,Movie,Ip Man 2,"Hong Kong, China",15/01/2016,2010,R,108 min,"Action & Adventure, International Movies"
80221553,TV Show,Kipo and the Age of Wonderbeasts,United States,14/01/2020,2020,TV-Y7-FV,1 Season,"Kids' TV, TV Comedies"
81060049,Movie,Leslie Jones: Time Machine,United States,14/01/2020,2020,TV-MA,66 min,Stand-Up Comedy
70244163,Movie,The Master,United States,14/01/2020,2012,R,137 min,"Dramas, Independent Movies"
81221851,Movie,Women of Mafia 2,Poland,14/01/2020,2019,TV-MA,132 min,"Action & Adventure, Dramas, International Movies"
81009823,Movie,Invisible Essence: The Little Prince,Canada,14/01/2019,2018,TV-PG,91 min,Documentaries
81020668,TV Show,La Grande Chaumière Violette,Taiwan,14/01/2019,2016,TV-14,1 Season,"International TV Shows, TV Dramas"
70298946,Movie,Camp X-Ray,United States,14/01/2017,2014,R,117 min,"Dramas, Independent Movies"
80144144,Movie,Estar o no estar,Mexico,14/01/2017,2016,TV-14,100 min,"Dramas, International Movies, Romantic Movies"
