show_id,type,title,country,date_added,release_year,rating,duration,listed_in
70109249,Movie,C Kkompany,India,31/05/2019,2008,TV-14,127 min,"Action & Adventure, Comedies, International Movies"
80993095,Movie,Chopsticks,India,31/05/2019,2019,TV-MA,101 min,"Comedies, Dramas, Independent Movies"
80218448,TV Show,How to Sell Drugs Online (Fast),Germany,31/05/2019,2019,TV-MA,1 Season,"Crime TV Shows, International TV Shows, TV Comedies"
80217946,TV Show,Killer Ratings,,31/05/2019,2019,TV-MA,1 Season,"Crime TV Shows, Docuseries, International TV Shows"
70045644,Movie,Koi Aap Sa,India,31/05/2019,2006,TV-14,135 min,"Comedies, International Movies, Music & Musicals"
70025612,Movie,Krishna Cottage,India,31/05/2019,2004,TV-MA,124 min,"Action & Adventure, Horror Movies, International Movies"
80237006,Movie,Mere Pyare Prime Minister,India,31/05/2019,2019,TV-MA,103 min,"Dramas, International Movies"
80160033,Movie,P,"United Kingdom, Thailand",31/05/2019,2006,TV-MA,105 min,"Horror Movies, International Movies"
81111849,Movie,Pegasus,China,31/05/2019,2019,TV-14,98 min,"Comedies, Dramas, International Movies"
80083930,Movie,Ragini MMS,India,31/05/2019,2011,TV-MA,93 min,"Horror Movies, International Movies"
80083752,Movie,Ragini MMS 2,India,31/05/2019,2014,TV-MA,113 min,"Horror Movies, International Movies"
70185023,Movie,Shor In the City,India,31/05/2019,2011,TV-MA,106 min,"Comedies, Dramas, Independent Movies"
80200549,TV Show,When They See Us,United States,31/05/2019,2019,TV-MA,1 Season,"Crime TV Shows, TV Dramas"
80189827,Movie,Bombshell: The Hedy Lamarr Story,United States,31/05/2018,2017,TV-14,89 min,Documentaries
80176144,Movie,Without Gorky,United Kingdom,31/05/2017,2011,TV-14,80 min,Documentaries
70202150,Movie,My Week with Marilyn,"United Kingdom, United States",30/05/2019,2011,R,99 min,"Dramas, Romantic Movies"
81010699,Movie,Svaha: The Sixth Finger,South Korea,30/05/2019,2019,TV-14,123 min,"International Movies, Thrillers"
70299863,Movie,The One I Love,United States,30/05/2019,2014,R,91 min,"Comedies, Dramas, Independent Movies"
80133554,Movie,Sarah Silverman A Speck of Dust,United States,30/05/2017,2017,TV-MA,71 min,Stand-Up Comedy
80208662,Movie,All In My Family,United States,03/05/2019,2019,TV-14,40 min,"Documentaries, LGBTQ Movies"
80994596,TV Show,Crime Diaries: Night Out,Mexico,03/05/2019,2019,TV-MA,1 Season,"Crime TV Shows, International TV Shows, Spanish-Language TV Shows"
80219707,TV Show,Dead to Me,United States,03/05/2019,2019,TV-MA,1 Season,"TV Comedies, TV Dramas"
81031939,Movie,Despite Everything,Spain,03/05/2019,2019,TV-MA,79 min,"Comedies, International Movies, Romantic Movies"
81028570,Movie,"Extremely Wicked, Shockingly Evil and Vile",United States,03/05/2019,2019,R,110 min,"Dramas, Independent Movies"
80207066,TV Show,Flinch,United Kingdom,03/05/2019,2019,TV-PG,1 Season,Reality TV
81035867,Movie,It's Fine,,03/05/2019,2012,TV-14,101 min,"Comedies, International Movies, Music & Musicals"
80244640,Movie,Jo Pil-ho: The Dawning Rage,South Korea,03/05/2019,2018,TV-MA,128 min,"Dramas, International Movies, Thrillers"
80999729,Movie,The Last Summer,United States,03/05/2019,2019,TV-14,110 min,"Comedies, Romantic Movies"
80198137,TV Show,Tuca & Bertie,United States,03/05/2019,2019,TV-MA,1 Season,TV Comedies
80225312,TV Show,Undercover,"Belgium, Netherlands",03/05/2019,2019,TV-MA,1 Season,"Crime TV Shows, International TV Shows, TV Dramas"
80992499,Movie,Si saben cómo me pongo ¿pá qué me invitan?,Colombia,03/05/2018,2018,TV-MA,89 min,"Comedies, International Movies"
80148223,Movie,Forever Pure,"United Kingdom, Israel, Russia",29/05/2017,2016,TV-MA,87 min,"Documentaries, International Movies, Sports Movies"
80176342,Movie,Rangoon,India,29/05/2017,2017,TV-14,153 min,"Action & Adventure, Dramas, International Movies"
80038162,Movie,Hot Girls Wanted,United States,29/05/2015,2015,NR,83 min,Documentaries
81087094,Movie,Lifechanger,Canada,28/05/2019,2018,TV-MA,84 min,"Horror Movies, Independent Movies, Thrillers"
80221447,Movie,The Nutcracker and the Four Realms,United States,28/05/2019,2018,PG,99 min,Children & Family Movies
70242063,Movie,After Porn Ends,United States,27/05/2019,2012,NR,93 min,Documentaries
81013657,TV Show,Charmed,United States,27/05/2019,2019,TV-PG,1 Season,"TV Dramas, TV Sci-Fi & Fantasy"
80994222,TV Show,Historical Roasts,United States,27/05/2019,2019,TV-MA,1 Season,"Stand-Up Comedy & Talk Shows, TV Comedies"
80239459,TV Show,The Break with Michelle Wolf,United States,27/05/2018,2018,TV-MA,1 Season,"Stand-Up Comedy & Talk Shows, TV Comedies"
80063265,Movie,The Do-Over,United States,27/05/2016,2016,TV-MA,109 min,"Action & Adventure, Comedies"
80993756,TV Show,Kiss The Series,,26/05/2019,2016,TV-14,1 Season,"International TV Shows, Romantic TV Shows, TV Dramas"
81034931,Movie,Rampant,South Korea,26/05/2019,2018,TV-MA,122 min,"Action & Adventure, Horror Movies, International Movies"
80202903,Movie,Sara's Notebook,Spain,26/05/2018,2018,TV-MA,117 min,"Dramas, International Movies, Thrillers"
80990935,TV Show,Something in the Rain,South Korea,26/05/2018,2018,TV-MA,1 Season,"International TV Shows, Korean TV Shows, Romantic TV Shows"
80167459,Movie,I Am Jane Doe,United States,26/05/2017,2017,TV-14,98 min,Documentaries
80169348,Movie,Joshua: Teenager vs. Superpower,United States,26/05/2017,2017,TV-14,79 min,Documentaries
80164778,Movie,Raees,India,26/05/2017,2017,NR,143 min,"Action & Adventure, Dramas, International Movies"
80068327,Movie,War Machine,United States,26/05/2017,2017,TV-MA,123 min,"Comedies, Dramas"
80087933,Movie,The Last Man on the Moon,United Kingdom,26/05/2016,2014,TV-PG,96 min,Documentaries
80993739,TV Show,Sotus The Series,Thailand,25/05/2019,2016,TV-14,1 Season,"International TV Shows, Romantic TV Shows, TV Dramas"
81132060,TV Show,Thackeray,India,25/05/2019,2019,TV-MA,1 Season,TV Shows
80084666,Movie,Colours of Passion,India,25/05/2018,2008,TV-14,114 min,"Dramas, International Movies"
80192137,Movie,Fernando Sanjiao: Hombre,Argentina,25/05/2018,2018,TV-MA,63 min,Stand-Up Comedy
80195049,Movie,Ibiza,United States,25/05/2018,2018,TV-MA,94 min,"Comedies, Romantic Movies"
80186850,Movie,Steve Martin and Martin Short: An Evening You Will Forget for the Rest of Your Life,United States,25/05/2018,2018,TV-14,74 min,Stand-Up Comedy
80117765,Movie,Detour,"United Kingdom, South Africa",25/05/2017,2016,R,97 min,Thrillers
81002195,Movie,After Maria,United States,24/05/2019,2019,TV-PG,38 min,Documentaries
81029429,TV Show,Hyper HardBoiled Gourmet Report,,24/05/2019,2017,TV-MA,1 Season,"Docuseries, International TV Shows"
81046255,Movie,Joy,Austria,24/05/2019,2019,TV-MA,101 min,"Dramas, Independent Movies, International Movies"
80218306,Movie,Rim of the World,United States,24/05/2019,2019,TV-14,99 min,"Action & Adventure, Independent Movies, Sci-Fi & Fantasy"
80211638,Movie,The Perfection,United States,24/05/2019,2019,TV-MA,91 min,"Horror Movies, LGBTQ Movies, Thrillers"
80197889,TV Show,WHAT / IF,United States,24/05/2019,2019,TV-MA,1 Season,"TV Dramas, TV Thrillers"
80220758,Movie,Survivors Guide to Prison,United States,24/05/2018,2017,TV-MA,103 min,Documentaries
81036190,Movie,The Lonely Island Presents: The Unauthorized Bash Brothers Experience,,23/05/2019,2019,TV-MA,30 min,"Comedies, Music & Musicals, Sports Movies"
80165083,Movie,Arès,France,23/05/2017,2016,TV-MA,80 min,"Action & Adventure, International Movies, Sci-Fi & Fantasy"
80134781,Movie,Hasan Minhaj: Homecoming King,,23/05/2017,2017,TV-MA,73 min,Stand-Up Comedy
80100106,TV Show,Dramaworld,"United States, South Korea, China",23/05/2016,2016,TV-14,1 Season,"Romantic TV Shows, TV Comedies, TV Dramas"
80244680,Movie,A Tale of Two Kitchens,,22/05/2019,2019,TV-G,30 min,"Documentaries, International Movies"
81057229,Movie,The Man Who Feels No Pain,India,22/05/2019,2018,TV-MA,137 min,"Action & Adventure, Comedies, International Movies"
80213536,TV Show,Mob Psycho 100,Japan,22/05/2018,2018,TV-MA,1 Season,"International TV Shows, TV Action & Adventure, TV Comedies"
80151384,Movie,Tig Notaro Happy To Be Here,United States,22/05/2018,2018,TV-14,58 min,Stand-Up Comedy
80098046,TV Show,12 Years Promise,South Korea,22/05/2017,2014,TV-14,1 Season,"International TV Shows, Korean TV Shows, Romantic TV Shows"
80091779,TV Show,Beating Again,South Korea,22/05/2017,2015,TV-14,1 Season,"International TV Shows, Korean TV Shows, Romantic TV Shows"
80091783,TV Show,Can We Get Married?,South Korea,22/05/2017,2012,TV-14,1 Season,"International TV Shows, Korean TV Shows, Romantic TV Shows"
80131167,Movie,Elizabeth at 90: A Family Tribute,United Kingdom,22/05/2017,2016,TV-G,90 min,Documentaries
80098047,TV Show,Last,South Korea,22/05/2017,2015,TV-14,1 Season,"Crime TV Shows, International TV Shows, Korean TV Shows"
80091781,TV Show,Secret Affair,South Korea,22/05/2017,2014,TV-14,1 Season,"International TV Shows, Korean TV Shows, Romantic TV Shows"
80091778,TV Show,This Is My Love,South Korea,22/05/2017,2015,TV-14,1 Season,"International TV Shows, Korean TV Shows, Romantic TV Shows"
70212980,TV Show,The Super Mario Bros. Super Show!,"United States, Canada",22/05/2016,1989,TV-Y7,1 Season,Kids' TV
80038335,Movie,Jen Kirkman: I'm Gonna Die Alone (And I Feel Fine),United States,22/05/2015,2015,TV-MA,78 min,Stand-Up Comedy
80011852,Movie,The Other One: The Long Strange Trip of Bob Weir,United States,22/05/2015,2015,TV-14,84 min,"Documentaries, Music & Musicals"
80121348,Movie,Moonlight,United States,21/05/2019,2016,R,111 min,"Dramas, Independent Movies, LGBTQ Movies"
81011598,Movie,Wanda Sykes: Not Normal,United States,21/05/2019,2019,TV-MA,66 min,Stand-Up Comedy
81005364,Movie,Zero,India,21/05/2019,2018,TV-14,159 min,"Comedies, Dramas, International Movies"
81076042,TV Show,American Experience: The Circus,United States,02/05/2019,2018,TV-PG,1 Season,Docuseries
81035880,Movie,Hamza's Suitcase,Egypt,02/05/2019,2017,TV-14,79 min,"Comedies, International Movies"
81103139,Movie,Her Only Choice,United States,02/05/2019,2018,TV-14,87 min,Dramas
70143369,Movie,John Carter,United States,02/05/2019,2012,PG-13,133 min,"Action & Adventure, Sci-Fi & Fantasy"
81096151,Movie,Laatu,India,02/05/2019,2018,TV-Y7,116 min,"Comedies, Dramas, International Movies"
70259801,Movie,Olympus Has Fallen,United States,02/05/2019,2013,R,119 min,Action & Adventure
80244271,TV Show,Revenge,,02/05/2019,2017,TV-MA,1 Season,"Crime TV Shows, International TV Shows, TV Dramas"
80990658,Movie,Jailbreak,Cambodia,02/05/2018,2017,TV-MA,92 min,"Action & Adventure, International Movies"
80133663,Movie,Maria Bamford: Old Baby,United States,02/05/2017,2017,TV-MA,64 min,Stand-Up Comedy
80117082,Movie,Two Lovers and a Bear,Canada,02/05/2017,2016,R,95 min,"Dramas, Independent Movies, Romantic Movies"
81043473,Movie,SGT. Will Gardner,United States,19/05/2019,2019,TV-MA,125 min,Dramas
80091267,Movie,Jalpari: The Desert Mermaid,India,19/05/2018,2012,TV-14,94 min,"Dramas, Independent Movies, International Movies"
80182919,Movie,Small Town Crime,United States,19/05/2018,2017,R,92 min,Thrillers
80121973,TV Show,Behzat Ç.,Turkey,19/05/2017,2010,TV-MA,1 Season,"Crime TV Shows, International TV Shows, TV Dramas"
80115466,Movie,BLAME!,Japan,19/05/2017,2017,TV-14,106 min,"Action & Adventure, Anime Features, International Movies"
80176819,TV Show,Hidden Singer,South Korea,19/05/2017,2015,TV-Y7,1 Season,"International TV Shows, Korean TV Shows, Reality TV"
80173481,TV Show,Highland: Thailand's Marijuana Awakening,Thailand,19/05/2017,2017,TV-MA,1 Season,"Docuseries, International TV Shows"
80142223,Movie,Laerte-se,Brazil,19/05/2017,2017,TV-MA,101 min,"Documentaries, International Movies, LGBTQ Movies"
80122179,TV Show,The Keepers,United States,19/05/2017,2017,TV-MA,1 Season,"Crime TV Shows, Docuseries, TV Mysteries"
80080768,Movie,The Blackcoat's Daughter,"Canada, United States",18/05/2019,2015,R,95 min,"Horror Movies, Independent Movies, Thrillers"
81061407,Movie,The Brawler,United States,18/05/2019,2019,TV-MA,95 min,"Dramas, Independent Movies, Sports Movies"
80161216,Movie,Cargo,"Australia, United Arab Emirates",18/05/2018,2018,TV-MA,104 min,"Horror Movies, International Movies"
80218111,Movie,Catching Feelings,South Africa,18/05/2018,2018,TV-MA,117 min,"Comedies, International Movies, Romantic Movies"
80996626,TV Show,Dance & Sing with True,,18/05/2018,2018,TV-Y,1 Season,Kids' TV
80047200,TV Show,El Clon,United States,18/05/2017,2010,TV-14,1 Season,"Romantic TV Shows, Spanish-Language TV Shows, TV Dramas"
80991872,TV Show,1994,Mexico,17/05/2019,2019,TV-MA,1 Season,"Crime TV Shows, Docuseries, International TV Shows"
81077863,Movie,Born in Gaza,Spain,17/05/2019,2014,TV-14,70 min,"Documentaries, International Movies"
81077851,Movie,Born in Syria,"Denmark, Spain",17/05/2019,2016,TV-14,87 min,"Documentaries, International Movies"
81073590,Movie,Dying to Tell,Spain,17/05/2019,2018,TV-MA,88 min,"Documentaries, International Movies"
81103108,Movie,First Impression,United States,17/05/2019,2018,TV-14,96 min,"Comedies, Romantic Movies"
80999455,TV Show,It's Bruno!,United States,17/05/2019,2019,TV-MA,1 Season,TV Comedies
80236341,Movie,Maria,Philippines,17/05/2019,2019,TV-MA,90 min,"Action & Adventure, International Movies"
80191050,Movie,ReMastered: The Lion's Share,,17/05/2019,2019,TV-14,84 min,"Documentaries, Music & Musicals"
81041271,Movie,Saverio Raimondo: Il Satiro Parlante,Italy,17/05/2019,2019,TV-MA,53 min,Stand-Up Comedy
80216758,Movie,See You Yesterday,United States,17/05/2019,2019,TV-MA,87 min,"Dramas, Sci-Fi & Fantasy, Thrillers"
81092192,TV Show,Well-Intended Love,China,17/05/2019,2019,TV-14,1 Season,"International TV Shows, Romantic TV Shows, TV Comedies"
70083809,Movie,Katt Williams: American Hustle (The Movie),United States,17/05/2018,2007,NR,89 min,Stand-Up Comedy
80028529,Movie,Tinker Bell and the Legend of the NeverBeast,United States,17/05/2015,2014,G,78 min,Children & Family Movies
70154110,Movie,Even the Rain,"Spain, Mexico, France",17/05/2011,2010,NR,103 min,"Dramas, International Movies"
80998967,Movie,Good Sam,United States,16/05/2019,2019,TV-PG,90 min,"Children & Family Movies, Dramas"
81038047,Movie,Jonaki,India,16/05/2019,2018,TV-14,96 min,"Dramas, Independent Movies, International Movies"
60021906,Movie,Kyo Kii... Main Jhuth Nahin Bolta,India,16/05/2019,2001,TV-PG,150 min,"Comedies, International Movies, Sci-Fi & Fantasy"
70142827,Movie,Limitless,United States,16/05/2019,2011,PG-13,105 min,"Action & Adventure, Sci-Fi & Fantasy, Thrillers"
70149579,Movie,"LSD: Love, Sex Aur Dhokha",India,16/05/2019,2010,TV-MA,112 min,"Dramas, Independent Movies, International Movies"
70109375,Movie,Mission Istaanbul: Darr Ke Aagey Jeet Hai,India,16/05/2019,2008,TV-MA,119 min,"Action & Adventure, International Movies, Music & Musicals"
70289558,Movie,Once Upon a Time in Mumbai Dobaara!,India,16/05/2019,2013,TV-14,142 min,"Dramas, International Movies, Music & Musicals"
81085319,Movie,PATRICK (2019),United Kingdom,16/05/2019,2019,TV-PG,94 min,Comedies
70117577,Movie,Take Me Home Tonight,"United States, Germany",16/05/2019,2011,R,97 min,"Comedies, Romantic Movies"
80227554,Movie,89,United Kingdom,16/05/2018,2017,TV-PG,87 min,Sports Movies
70158421,Movie,Action Replayy,India,16/05/2018,2010,TV-PG,129 min,"Children & Family Movies, Comedies, International Movies"
20258084,Movie,Andaz Apna Apna,India,16/05/2018,1994,TV-PG,160 min,"Comedies, Cult Movies, International Movies"
80233511,Movie,Food on the Go,"Argentina, Italy",16/05/2018,2017,TV-14,66 min,"Documentaries, International Movies"
80097814,Movie,Christine,"United Kingdom, United States",16/05/2017,2016,R,119 min,"Dramas, Independent Movies"
70241757,Movie,The Place Beyond the Pines,United States,16/05/2017,2012,R,140 min,"Dramas, Independent Movies"
80133551,Movie,Tracy Morgan: Staying Alive,United States,16/05/2017,2017,TV-MA,59 min,Stand-Up Comedy
81110388,Movie,7 Din Mohabbat In,Pakistan,15/05/2019,2018,TV-PG,137 min,"Comedies, International Movies, Music & Musicals"
80220311,Movie,All the Devil's Men,United Kingdom,15/05/2019,2018,R,100 min,Action & Adventure
81110389,Movie,Cake,"United Kingdom, Pakistan",15/05/2019,2018,TV-14,125 min,"Comedies, Dramas, International Movies"
81112772,TV Show,Dennis and Gnasher Unleashed,United Kingdom,15/05/2019,2017,TV-Y7,1 Season,"British TV Shows, Kids' TV, TV Comedies"
70111279,Movie,EMI: Liya Hai To Chukana Padega,India,15/05/2019,2008,TV-14,128 min,"Comedies, Dramas, International Movies"
81123050,Movie,Hamid,India,15/05/2019,2018,TV-14,108 min,"Dramas, Independent Movies, International Movies"
81037237,TV Show,"Heidi, bienvenida a casa",Argentina,15/05/2019,2017,TV-G,1 Season,"Kids' TV, Spanish-Language TV Shows"
81087124,TV Show,I Hear You,,15/05/2019,2019,TV-14,1 Season,"International TV Shows, Romantic TV Shows, TV Dramas"
70007056,Movie,Kucch To Hai,India,15/05/2019,2003,TV-14,136 min,"Dramas, International Movies, Thrillers"
70035357,Movie,Kyaa Kool Hai Hum,India,15/05/2019,2005,TV-14,165 min,"Comedies, International Movies, Music & Musicals"
80108481,Movie,Kyaa Kool Hain Hum 3,India,15/05/2019,2016,R,124 min,"Comedies, International Movies"
70153178,Movie,Once Upon a Time in Mumbaai,India,15/05/2019,2010,NR,133 min,"Dramas, International Movies, Music & Musicals"
70073018,Movie,Shootout at Lokhandwala,India,15/05/2019,2007,UR,116 min,"Action & Adventure, Dramas, International Movies"
80994416,Movie,Aadu 2,India,15/05/2018,2017,TV-14,150 min,"Comedies, International Movies"
80243408,Movie,Aiyaary,India,15/05/2018,2018,TV-14,158 min,"Action & Adventure, Dramas, International Movies"
80994418,Movie,Chalay Thay Saath,Pakistan,15/05/2018,2017,TV-14,118 min,"Comedies, Dramas, International Movies"
70050576,Movie,Lupin the 3rd: The Castle of Cagliostro: Special Edition,Japan,15/05/2018,1979,PG-13,100 min,"Action & Adventure, Anime Features, Classic Movies"
70253596,Movie,Only God Forgives,"Denmark, France, United States, Sweden",15/05/2018,2013,R,90 min,"Cult Movies, Independent Movies, Thrillers"
70273371,TV Show,Saint Seiya: The Lost Canvas,Japan,15/05/2018,2009,TV-14,1 Season,"Anime Series, International TV Shows"
80157133,Movie,Chamatkar,India,15/05/2017,1992,TV-14,164 min,"Comedies, International Movies, Sci-Fi & Fantasy"
80122237,TV Show,Classic Legends,India,15/05/2017,2012,TV-PG,1 Season,"Docuseries, International TV Shows"
80107656,Movie,Command and Control,United States,15/05/2017,2017,TV-PG,92 min,Documentaries
80157083,Movie,Kabhi Haan Kabhi Naa,India,15/05/2017,1994,TV-14,151 min,"Comedies, Dramas, International Movies"
80098287,Movie,Lovesong,United States,15/05/2017,2016,TV-MA,84 min,"Dramas, Independent Movies, Romantic Movies"
80059342,Movie,Natascha Kampusch: The Whole Story,United States,15/05/2017,2010,TV-14,51 min,Movies
24081514,Movie,Ram Jaane,India,15/05/2017,1995,TV-14,142 min,"Dramas, International Movies, Music & Musicals"
80047031,TV Show,Sin senos no hay paraíso,"Colombia, Mexico, United States",15/05/2017,2008,TV-14,1 Season,"International TV Shows, Spanish-Language TV Shows, TV Dramas"
80128688,Movie,Smash: Motorized Mayhem,United States,15/05/2017,2017,TV-MA,66 min,"Documentaries, Sports Movies"
80157564,Movie,The Devil's Mistress,"Czech Republic, Slovakia",15/05/2017,2016,TV-14,110 min,"Dramas, International Movies"
80178078,Movie,The Intent,United Kingdom,15/05/2017,2016,TV-MA,99 min,"Dramas, International Movies, Thrillers"
80104330,Movie,Attacking the Devil: Harold Evans and the Last Nazi War Crime,United Kingdom,15/05/2016,2014,TV-14,102 min,"Documentaries, International Movies"
81053958,Movie,Backdraft 2,United States,14/05/2019,2019,R,102 min,"Action & Adventure, Dramas"
81094666,Movie,Killer Cove,United States,14/05/2019,2018,TV-14,87 min,Thrillers
80992787,TV Show,Revisions,Japan,14/05/2019,2018,TV-14,1 Season,"Anime Series, International TV Shows"
81036199,Movie,Still LAUGH-IN: The Stars Celebrate,United States,14/05/2019,2019,TV-MA,61 min,Comedies
81016247,Movie,Weed the People,United States,14/05/2019,2018,TV-14,94 min,Documentaries
80097726,TV Show,The Hunt,United Kingdom,14/05/2017,2015,TV-PG,1 Season,"British TV Shows, Docuseries, Science & Nature TV"
80223928,Movie,Malibu Rescue,United States,13/05/2019,2019,TV-G,70 min,"Children & Family Movies, Comedies"
81065331,Movie,Norm of the North: Keys to the Kingdom,"India, United States",13/05/2019,2019,TV-PG,92 min,Children & Family Movies
80186940,Movie,Ali Wong: Hard Knock Wife,United States,13/05/2018,2018,TV-MA,64 min,Stand-Up Comedy
80120740,Movie,Wild Oats,"United States, Germany",13/05/2017,2016,PG-13,86 min,Comedies
81077874,Movie,Merata: How Mum Decolonised the Screen,New Zealand,12/05/2019,2018,TV-14,88 min,Documentaries
81098013,TV Show,The Defected,"China, Hong Kong",12/05/2019,2019,TV-MA,1 Season,"Crime TV Shows, International TV Shows, TV Dramas"
80117736,Movie,Spivak,United States,12/05/2018,2017,TV-MA,92 min,"Comedies, Independent Movies"
80174364,TV Show,All Hail King Julien: Exiled,United States,12/05/2017,2017,TV-Y7-FV,1 Season,"Kids' TV, TV Action & Adventure, TV Comedies"
80114666,Movie,Get Me Roger Stone,United States,12/05/2017,2017,TV-MA,101 min,Documentaries
80157866,Movie,Mindhorn,United Kingdom,12/05/2017,2017,TV-MA,88 min,"Comedies, Cult Movies, Independent Movies"
80161029,Movie,Sahara,"France, Canada",12/05/2017,2017,TV-Y7,86 min,Children & Family Movies
81039410,Movie,Dry Martina,"Chile, Argentina",11/05/2019,2018,TV-MA,100 min,"Dramas, Independent Movies, International Movies"
81012340,Movie,Shéhérazade,France,11/05/2019,2019,TV-MA,111 min,"Dramas, Independent Movies, International Movies"
70242536,Movie,The Great Magician,"Hong Kong, China",11/05/2019,2011,TV-PG,128 min,"Action & Adventure, Comedies, Dramas"
70287630,TV Show,The Jungle Book,"India, Germany, France",11/05/2019,2010,TV-Y7,1 Season,Kids' TV
80192065,Movie,Carlos Ballarta: Furia Ñera,Mexico,11/05/2018,2018,TV-MA,63 min,Stand-Up Comedy
80158319,TV Show,Evil Genius,United States,11/05/2018,2018,TV-MA,1 Season,"Crime TV Shows, Docuseries, TV Mysteries"
80143556,Movie,The Kissing Booth,"United Kingdom, United States",11/05/2018,2018,TV-14,105 min,"Comedies, Romantic Movies"
80184379,TV Show,The Who Was? Show,United States,11/05/2018,2018,TV-Y7,1 Season,"Kids' TV, TV Comedies"
81092777,Movie,Bheemayan,,10/05/2019,2018,TV-Y7-FV,63 min,Children & Family Movies
81092779,Movie,Chhota Bheem Aur Kaala Yodha,,10/05/2019,2018,TV-Y7,63 min,Movies
81092776,Movie,Chhota Bheem Ka Romani Adventure,,10/05/2019,2018,TV-Y7,62 min,Children & Family Movies
81092778,Movie,Chhota Bheem Ka Troll Se Takkar,,10/05/2019,2018,TV-Y7,62 min,Movies
80216541,Movie,In Family I Trust,Spain,10/05/2019,2018,TV-MA,98 min,"Comedies, Dramas, International Movies"
80216756,TV Show,Jailbirds,,10/05/2019,2019,TV-MA,1 Season,Reality TV
80241986,TV Show,Pose,United States,10/05/2019,2018,TV-MA,1 Season,TV Dramas
80987113,TV Show,The Princess Weiyoung,China,10/05/2019,2016,TV-14,1 Season,"International TV Shows, Romantic TV Shows, TV Dramas"
80197989,TV Show,The Society,United States,10/05/2019,2019,TV-MA,1 Season,"TV Dramas, Teen TV Shows"
80194950,Movie,Wine Country,United States,10/05/2019,2019,R,104 min,Comedies
70261058,Movie,Aiyyaa,India,10/05/2017,2012,TV-14,151 min,"Comedies, International Movies, Music & Musicals"
70204288,Movie,Bbuddah Hoga Terra Baap,India,10/05/2017,2011,TV-14,116 min,"Action & Adventure, Comedies, Dramas"
80057278,Movie,Gabbar Is Back,India,10/05/2017,2015,TV-14,128 min,"Action & Adventure, Dramas, International Movies"
70293703,Movie,Madras Café,India,10/05/2017,2013,NR,128 min,"Dramas, International Movies, Thrillers"
80165853,Movie,Michael,India,10/05/2017,2011,TV-MA,86 min,"Dramas, Independent Movies, International Movies"
80161108,Movie,The Adventure Club,Canada,10/05/2017,2016,TV-Y7,88 min,Children & Family Movies
80082660,Movie,The Apostate,"Spain, France, Uruguay",10/05/2017,2015,TV-MA,80 min,"Comedies, Dramas, International Movies"
80028359,Movie,Russell Madness,United States,10/05/2015,2015,PG,93 min,"Children & Family Movies, Comedies, Sports Movies"
81076049,Movie,American Experience: The Island Murder,United States,01/05/2019,2018,TV-14,53 min,Documentaries
60031264,Movie,Dr. Seuss' The Cat in the Hat,United States,01/05/2019,2003,PG,82 min,"Children & Family Movies, Comedies"
81059956,Movie,Familiye,Germany,01/05/2019,2017,TV-MA,99 min,"Dramas, Independent Movies, International Movies"
81094667,Movie,Hidden in Plain Sight,United States,01/05/2019,2019,TV-14,87 min,"Dramas, Independent Movies, Thrillers"
81069255,Movie,John & Yoko: Above Us Only Sky,United Kingdom,01/05/2019,2018,TV-14,90 min,"Documentaries, Music & Musicals"
81094083,Movie,Kia and Cosmos,India,01/05/2019,2018,TV-14,124 min,"Dramas, Independent Movies, International Movies"
80208082,Movie,Kill Hitler! The Luck of the Devil,France,01/05/2019,2015,TV-14,53 min,"Documentaries, International Movies"
81080637,Movie,Knock Down The House,United States,01/05/2019,2019,PG,88 min,Documentaries
80197303,Movie,Le serment des Hitler,France,01/05/2019,2014,TV-PG,54 min,"Documentaries, International Movies"
81049260,Movie,Munafik 2,Malaysia,01/05/2019,2018,TV-MA,104 min,"Horror Movies, International Movies"
81017593,Movie,Robin Hood: The Rebellion,United Kingdom,01/05/2019,2018,TV-14,92 min,"Action & Adventure, Independent Movies, International Movies"
81062075,TV Show,"Roswell, New Mexico",United States,01/05/2019,2019,TV-14,1 Season,"Classic & Cult TV, TV Dramas, TV Sci-Fi & Fantasy"
70270364,Movie,Snowpiercer,"South Korea, Czech Republic",01/05/2019,2013,R,126 min,"Action & Adventure, Cult Movies, International Movies"
81093342,Movie,Sur Sapata,India,01/05/2019,2019,TV-14,140 min,"Comedies, Dramas, International Movies"
