show_id,type,title,country,date_added,release_year,rating,duration,listed_in
81145628,Movie,Norm of the North: King Sized Adventure,"United States, India, South Korea, China",09/09/2019,2019,TV-PG,90 min,"Children & Family Movies, Comedies"
80117401,Movie,Jandino: Whatever it Takes,United Kingdom,09/09/2016,2016,TV-MA,94 min,Stand-Up Comedy
70234439,TV Show,Transformers Prime,United States,08/09/2018,2013,TV-Y7-FV,1 Season,Kids' TV
80058654,TV Show,Transformers: Robots in Disguise,United States,08/09/2018,2016,TV-Y7,1 Season,Kids' TV
80125979,Movie,#realityhigh,United States,08/09/2017,2017,TV-14,99 min,Comedies
80163890,TV Show,Apaches,Spain,08/09/2017,2016,TV-MA,1 Season,"Crime TV Shows, International TV Shows, Spanish-Language TV Shows"
70304989,Movie,Automata,"Bulgaria, United States, Spain, Canada",08/09/2017,2014,R,110 min,"International Movies, Sci-Fi & Fantasy, Thrillers"
80164077,Movie,Fabrizio Copano: Solo pienso en mi,Chile,08/09/2017,2017,TV-MA,60 min,Stand-Up Comedy
80117902,TV Show,Fire Chasers,United States,08/09/2017,2017,TV-MA,1 Season,"Docuseries, Science & Nature TV"
70304990,Movie,Good People,"United States, United Kingdom, Denmark, Sweden",08/09/2017,2014,R,90 min,"Action & Adventure, Thrillers"
80169755,Movie,Joaquín Reyes: Una y no más,,08/09/2017,2017,TV-MA,78 min,Stand-Up Comedy
70299204,Movie,Kidnapping Mr. Heineken,"Netherlands, Belgium, United Kingdom, United States",08/09/2017,2015,R,95 min,"Action & Adventure, Dramas, International Movies"
80182480,Movie,Krish Trish and Baltiboy,,08/09/2017,2009,TV-Y7,58 min,Children & Family Movies
80182483,Movie,Krish Trish and Baltiboy: Battle of Wits,,08/09/2017,2013,TV-Y7,62 min,Children & Family Movies
80182596,Movie,Krish Trish and Baltiboy: Best Friends Forever,,08/09/2017,2016,TV-Y,65 min,Children & Family Movies
80182482,Movie,Krish Trish and Baltiboy: Comics of India,,08/09/2017,2012,TV-Y7,61 min,Children & Family Movies
80182597,Movie,Krish Trish and Baltiboy: Oversmartness Never Pays,,08/09/2017,2017,TV-Y7,65 min,Children & Family Movies
80182481,Movie,Krish Trish and Baltiboy: Part II,,08/09/2017,2010,TV-Y7,58 min,Children & Family Movies
80182621,Movie,Krish Trish and Baltiboy: The Greatest Trick,,08/09/2017,2013,TV-Y7,60 min,Children & Family Movies
80057969,Movie,Love,"France, Belgium",08/09/2017,2015,NR,135 min,"Cult Movies, Dramas, Independent Movies"
80060297,Movie,Manhattan Romance,United States,08/09/2017,2014,TV-14,98 min,"Comedies, Independent Movies, Romantic Movies"
80046728,Movie,Moonwalkers,"France, Belgium",08/09/2017,2015,R,96 min,"Action & Adventure, Comedies, International Movies"
80046727,Movie,Rolling Papers,"United States, Uruguay",08/09/2017,2015,TV-MA,79 min,Documentaries
70304988,Movie,Stonehearst Asylum,United States,08/09/2017,2014,PG-13,113 min,"Horror Movies, Thrillers"
80057700,Movie,The Runner,United States,08/09/2017,2015,R,90 min,"Dramas, Independent Movies"
80045922,Movie,6 Years,United States,08/09/2015,2015,NR,80 min,"Dramas, Independent Movies, Romantic Movies"
80244601,TV Show,Castle of Stars,,07/09/2018,2015,TV-14,1 Season,"International TV Shows, Romantic TV Shows, TV Comedies"
80203094,Movie,City of Joy,"United States,",07/09/2018,2018,TV-MA,77 min,Documentaries
80190843,TV Show,First and Last,,07/09/2018,2018,TV-MA,1 Season,Docuseries
70241607,Movie,Laddaland,Thailand,07/09/2018,2011,TV-MA,112 min,"Horror Movies, International Movies"
80988892,Movie,Next Gen,"China, Canada, United States",07/09/2018,2018,TV-PG,106 min,"Children & Family Movies, Comedies, Sci-Fi & Fantasy"
80239639,Movie,Sierra Burgess Is A Loser,United States,07/09/2018,2018,PG-13,106 min,"Comedies, Romantic Movies"
80159586,Movie,The Most Assassinated Woman in the World,"Belgium, United Kingdom, United States",07/09/2018,2018,TV-MA,102 min,"Dramas, International Movies, Thrillers"
80152447,Movie,Cézanne et moi,"Belgium, France",07/09/2017,2016,R,114 min,"Dramas, Independent Movies, International Movies"
80221550,TV Show,Archibald's Next Big Thing,,06/09/2019,2019,TV-Y7,1 Season,"Kids' TV, TV Comedies"
81154455,Movie,Article 15,India,06/09/2019,2019,TV-MA,125 min,"Dramas, International Movies, Thrillers"
81113928,Movie,Care of Kancharapalem,,06/09/2019,2018,TV-14,142 min,"Comedies, Dramas, Independent Movies"
81052275,Movie,Ee Nagaraniki Emaindi,India,06/09/2019,2018,TV-14,133 min,"Comedies, International Movies"
81132437,Movie,Kill Me If You Dare,,06/09/2019,2019,TV-14,100 min,"Comedies, International Movies, Romantic Movies"
80178151,TV Show,The Spy,France,06/09/2019,2019,TV-MA,1 Season,"International TV Shows, TV Dramas, TV Thrillers"
80058026,Movie,Hell and Back,United States,06/09/2018,2015,R,86 min,"Action & Adventure, Comedies, Independent Movies"
70303496,Movie,PK,India,06/09/2018,2014,TV-14,146 min,"Comedies, Dramas, International Movies"
80162141,Movie,Hard Tide,United Kingdom,06/09/2017,2015,TV-MA,79 min,"Dramas, Independent Movies"
80095641,Movie,Elstree 1976,United Kingdom,06/09/2016,2015,TV-PG,102 min,Documentaries
81176188,Movie,American Factory: A Conversation with the Obamas,,05/09/2019,2019,TV-G,10 min,Documentaries
80159880,Movie,ATM,"United States, Canada",05/09/2018,2012,TV-14,122 min,"Comedies, International Movies, Romantic Movies"
81016044,Movie,Bangkok Traffic (Love) Story,Thailand,05/09/2018,2009,TV-14,126 min,"Comedies, International Movies, Romantic Movies"
80158838,Movie,I Fine... Thank You... Love You,Thailand,05/09/2018,2014,TV-14,116 min,"Comedies, International Movies, Romantic Movies"
81016045,Movie,One Day,Thailand,05/09/2018,2016,TV-PG,135 min,"Dramas, International Movies, Romantic Movies"
70142798,Movie,Phobia 2,Thailand,05/09/2018,2009,TV-MA,125 min,"Horror Movies, International Movies"
70062814,Movie,Shutter,Thailand,05/09/2018,2004,TV-MA,96 min,"Horror Movies, International Movies"
80158839,Movie,Suckseed,Thailand,05/09/2018,2011,TV-MA,130 min,"Comedies, International Movies"
80147760,Movie,Carrie Pilby,United States,05/09/2017,2016,TV-14,98 min,"Comedies, Dramas"
80177405,Movie,Marc Maron: Too Real,United States,05/09/2017,2017,TV-MA,70 min,Stand-Up Comedy
80113482,TV Show,No Tomorrow,United States,05/09/2017,2016,TV-14,1 Season,"Romantic TV Shows, TV Comedies, TV Dramas"
81160036,Movie,Saawan,Pakistan,04/09/2019,2016,TV-14,128 min,"Dramas, Independent Movies, International Movies"
81173255,Movie,The Heretics,Canada,04/09/2019,2017,TV-MA,88 min,Horror Movies
81078908,Movie,The World We Make,United States,04/09/2019,2019,PG,108 min,"Dramas, Romantic Movies"
81155784,Movie,Watchman,India,04/09/2019,2019,TV-14,93 min,"Comedies, Dramas, International Movies"
80201906,Movie,Black Panther,United States,04/09/2018,2018,PG-13,135 min,"Action & Adventure, Sci-Fi & Fantasy"
80052612,Movie,Man Up,"United Kingdom, France",04/09/2018,2015,R,88 min,"Comedies, International Movies, Romantic Movies"
80113641,TV Show,Frequency,United States,04/09/2017,2016,TV-14,1 Season,"Crime TV Shows, TV Dramas, TV Mysteries"
81054495,Movie,Mo Gilligan: Momentum,United Kingdom,30/09/2019,2019,TV-MA,64 min,Stand-Up Comedy
80996949,TV Show,Adam Ruins Everything,United States,30/09/2018,2018,TV-14,1 Season,TV Comedies
80239337,TV Show,Ben 10,United States,30/09/2018,2016,TV-Y7,1 Season,Kids' TV
70212504,Movie,Big Miracle,"United States, United Kingdom",30/09/2018,2012,PG,107 min,"Children & Family Movies, Dramas"
81011682,TV Show,Christiane Amanpour: Sex & Love Around the World,United States,30/09/2018,2018,TV-MA,1 Season,Docuseries
80128317,TV Show,The Eighties,United States,30/09/2018,2016,TV-PG,1 Season,Docuseries
81027384,TV Show,The Nineties,United States,30/09/2018,2017,TV-14,1 Season,Docuseries
80030186,TV Show,The Seventies,United States,30/09/2018,2015,TV-PG,1 Season,Docuseries
80116921,TV Show,We Bare Bears,United States,30/09/2018,2017,TV-Y7,1 Season,"Kids' TV, TV Comedies"
80187061,Movie,The Mayor,South Korea,30/09/2017,2017,TV-MA,130 min,"Dramas, International Movies"
80181555,TV Show,The Royal House of Windsor,United Kingdom,30/09/2017,2017,TV-14,1 Season,"British TV Shows, Docuseries, International TV Shows"
80081155,Movie,Amanda Knox,"Denmark, United States",30/09/2016,2016,TV-MA,92 min,Documentaries
80184358,TV Show,Lovesick,,03/09/2018,2014,TV-14,1 Season,"International TV Shows, Romantic TV Shows, TV Dramas"
80198585,Movie,The Debt Collector,"United Kingdom, United States",03/09/2018,2018,TV-MA,96 min,Action & Adventure
70233894,Movie,Act of Vengeance,"Turkey, United States",29/09/2018,2010,NR,112 min,"Action & Adventure, International Movies"
81011955,Movie,Paradise Lost,Brazil,29/09/2018,2018,TV-MA,111 min,"Dramas, Independent Movies, International Movies"
80128722,Movie,Gerald's Game,United States,29/09/2017,2017,TV-MA,103 min,"Horror Movies, Thrillers"
80182115,Movie,Long Shot,United States,29/09/2017,2017,TV-14,40 min,Documentaries
80163293,TV Show,Mak Cun,,29/09/2017,2015,TV-PG,1 Season,"International TV Shows, TV Comedies, TV Dramas"
80104068,Movie,Our Souls at Night,United States,29/09/2017,2017,TV-14,103 min,"Dramas, Romantic Movies"
80119349,Movie,Out of Thin Air,,29/09/2017,2017,TV-14,85 min,"Documentaries, International Movies"
80199032,TV Show,Paul Hollywood's Big Continental Road Trip,United Kingdom,29/09/2017,2017,TV-14,1 Season,"British TV Shows, Docuseries, International TV Shows"
80180449,TV Show,Satu Hari,,29/09/2017,2014,TV-14,1 Season,"International TV Shows, TV Dramas"
80019931,Movie,"Monster High: Boo York, Boo York",United States,29/09/2015,2015,TV-Y7,72 min,"Children & Family Movies, Music & Musicals"
81053893,Movie,Cultivating the Seas: History and Future of the Full-Cycle Cultured Kindai Tuna,,28/09/2019,2019,TV-G,45 min,"Documentaries, International Movies"
80200087,Movie,Domino,"Denmark, France, Italy, Belgium, Netherlands",28/09/2019,2019,R,89 min,"International Movies, Thrillers"
81053892,Movie,TUNA GIRL,,28/09/2019,2019,TV-PG,90 min,"Dramas, International Movies"
81002850,Movie,5CM,Indonesia,28/09/2018,2012,TV-14,126 min,"Dramas, International Movies"
81004470,Movie,Animal World,China,28/09/2018,2018,TV-MA,130 min,"Action & Adventure, International Movies, Sci-Fi & Fantasy"
80157072,Movie,Hold the Dark,United States,28/09/2018,2018,TV-MA,126 min,"Action & Adventure, Dramas"
81001809,Movie,Lessons from a School Shooting: Notes from Dunblane,United States,28/09/2018,2018,TV-PG,24 min,Documentaries
80201933,TV Show,Made in Mexico,United States,28/09/2018,2018,TV-MA,1 Season,"International TV Shows, Reality TV, Spanish-Language TV Shows"
81002864,Movie,Single,Indonesia,28/09/2018,2015,TV-PG,127 min,"Comedies, International Movies, Romantic Movies"
81016750,Movie,The 3rd Eye,Indonesia,28/09/2018,2018,TV-MA,108 min,"Horror Movies, International Movies"
81002866,Movie,The Sinking Of Van Der Wijck,Indonesia,28/09/2018,2013,TV-14,163 min,"Dramas, International Movies, Romantic Movies"
80992039,Movie,Two Catalonias,Spain,28/09/2018,2018,TV-MA,117 min,"Documentaries, International Movies"
80126507,Movie,Bobby Sands: 66 Days,"Ireland, United Kingdom",28/09/2017,2016,TV-14,106 min,Documentaries
80225885,TV Show,Bard of Blood,India,27/09/2019,2019,TV-MA,1 Season,"International TV Shows, TV Action & Adventure, TV Dramas"
81132443,Movie,Deliha 2,Turkey,27/09/2019,2018,TV-PG,102 min,"Comedies, International Movies"
80218107,TV Show,Dragons: Rescue Riders,,27/09/2019,2019,TV-Y,1 Season,"Kids' TV, TV Comedies"
80231903,Movie,In the Shadow of the Moon,United States,27/09/2019,2019,TV-MA,116 min,"Dramas, Sci-Fi & Fantasy, Thrillers"
80220715,TV Show,Skylines,,27/09/2019,2019,TV-MA,1 Season,"Crime TV Shows, International TV Shows, TV Dramas"
81171121,Movie,Sturgill Simpson Presents Sound & Fury,United States,27/09/2019,2019,TV-MA,42 min,"Anime Features, Music & Musicals, Sci-Fi & Fantasy"
80241248,TV Show,The Politician,United States,27/09/2019,2019,TV-14,1 Season,"TV Comedies, TV Dramas, Teen TV Shows"
81012295,Movie,Weeds on Fire,Hong Kong,27/09/2018,2016,TV-14,95 min,"Dramas, Independent Movies, International Movies"
80060037,Movie,Much Loved,"France, Morocco",27/09/2017,2015,TV-MA,104 min,"Dramas, Independent Movies, International Movies"
60003155,Movie,Joseph: King of Dreams,United States,27/09/2011,2000,TV-PG,75 min,"Children & Family Movies, Dramas, Faith & Spirituality"
81177238,Movie,Malaal,India,26/09/2019,2019,TV-14,133 min,"International Movies, Romantic Movies"
70270775,Movie,The Grandmaster,"Hong Kong, China",26/09/2019,2013,PG-13,108 min,"Action & Adventure, Dramas, International Movies"
81025403,TV Show,The Inmate,Mexico,26/09/2019,2018,TV-MA,1 Season,"Crime TV Shows, International TV Shows, Spanish-Language TV Shows"
80215923,Movie,The Hurricane Heist,United States,26/09/2018,2018,PG-13,103 min,Action & Adventure
80151483,Movie,Def Comedy Jam 25,United States,26/09/2017,2017,TV-MA,82 min,Stand-Up Comedy
80173625,Movie,Restless Creature: Wendy Whelan,United States,26/09/2017,2016,TV-MA,94 min,Documentaries
80005444,Movie,Print the Legend,United States,26/09/2014,2014,TV-14,100 min,Documentaries
80244682,Movie,Birders,"United States, Mexico",25/09/2019,2019,TV-G,38 min,"Documentaries, International Movies"
81075519,Movie,Furie,Vietnam,25/09/2019,2019,TV-MA,97 min,"Action & Adventure, Dramas, International Movies"
80166318,Movie,Leap!,"France, Canada",25/09/2019,2016,PG,89 min,"Children & Family Movies, Comedies"
81186758,Movie,Oh! Baby (Malayalam),India,25/09/2019,2019,TV-14,146 min,"Comedies, International Movies, Music & Musicals"
81186757,Movie,Oh! Baby (Tamil),India,25/09/2019,2019,TV-14,146 min,"Comedies, International Movies, Music & Musicals"
80108976,Movie,USS Indianapolis: Men of Courage,United States,25/09/2019,2016,R,130 min,Action & Adventure
80208155,Movie,A Wrinkle in Time,United States,25/09/2018,2018,PG,110 min,Children & Family Movies
80198423,Movie,Teach Us All,United States,25/09/2017,2017,TV-14,81 min,Documentaries
80162144,Movie,White Island,United Kingdom,25/09/2017,2016,TV-MA,91 min,"Comedies, Independent Movies, Thrillers"
81053953,Movie,Inside Man: Most Wanted,United States,24/09/2019,2019,R,106 min,Action & Adventure
81074113,Movie,Jeff Dunham: Beside Himself,United States,24/09/2019,2019,TV-MA,58 min,Stand-Up Comedy
80992496,Movie,China Salesman,China,24/09/2018,2017,TV-MA,111 min,"Action & Adventure, International Movies"
70304191,Movie,Swearnet: The Movie,Canada,24/09/2017,2014,NR,112 min,"Comedies, International Movies"
80103311,Movie,The Bar,"Spain, Argentina",24/09/2017,2017,TV-MA,102 min,"Comedies, Horror Movies, International Movies"
81176200,Movie,Manmadhudu 2,India,23/09/2019,2019,TV-MA,152 min,"Comedies, Dramas, International Movies"
80238106,TV Show,Team Kaylie,,23/09/2019,2019,TV-PG,1 Season,"Kids' TV, TV Comedies"
80208906,Movie,Under the Eiffel Tower,United States,23/09/2019,2018,TV-MA,87 min,"Comedies, Independent Movies, Romantic Movies"
80097321,Movie,Audrie & Daisy,United States,23/09/2016,2016,TV-14,99 min,Documentaries
80106966,Movie,Iliza Shlesinger: Confirmed Kills,United States,23/09/2016,2016,TV-MA,78 min,Stand-Up Comedy
81004814,TV Show,BONDING,United States,22/09/2019,2019,TV-MA,1 Season,"TV Comedies, TV Dramas"
81080769,Movie,Do Paise Ki Dhoop Chaar Aane Ki Baarish,India,22/09/2019,2009,TV-14,121 min,"Dramas, Independent Movies, International Movies"
70267838,Movie,20 Feet From Stardom,United States,22/09/2018,2013,PG-13,91 min,"Documentaries, Music & Musicals"
80211380,Movie,In Darkness,"United Kingdom, United States",22/09/2018,2018,TV-MA,101 min,"Independent Movies, International Movies, Thrillers"
80196586,Movie,Gaga: Five Foot Two,United States,22/09/2017,2017,TV-MA,101 min,"Documentaries, Music & Musicals"
80099204,Movie,The Bad Batch,United States,22/09/2017,2016,R,119 min,"Dramas, Independent Movies, Thrillers"
80059432,Movie,SMOSH: The Movie,United States,22/09/2015,2015,PG-13,83 min,Comedies
81172721,Movie,King of Boys,Nigeria,21/09/2019,2018,TV-MA,182 min,"Dramas, International Movies"
81172727,Movie,Merry Men: The Real Yoruba Demons,Nigeria,21/09/2019,2018,TV-MA,106 min,"Comedies, International Movies"
70153543,Movie,Sarah's Key,France,21/09/2019,2010,PG-13,102 min,"Dramas, International Movies"
81172728,Movie,The Wedding Party 2: Destination Dubai,Nigeria,21/09/2019,2017,TV-14,98 min,"Comedies, International Movies, Romantic Movies"
81095101,TV Show,Vagabond,South Korea,21/09/2019,2019,TV-MA,1 Season,"International TV Shows, Korean TV Shows, TV Action & Adventure"
80195173,TV Show,Battlefish,,21/09/2018,2018,TV-MA,1 Season,"Reality TV, Science & Nature TV, TV Action & Adventure"
80241960,TV Show,DRAGON PILOT: Hisone & Masotan,Japan,21/09/2018,2018,TV-14,1 Season,"Anime Series, International TV Shows"
80115346,TV Show,Hilda,"United Kingdom, Canada, United States",21/09/2018,2018,TV-Y7,1 Season,Kids' TV
80124522,TV Show,Maniac,United States,21/09/2018,2018,TV-MA,1 Season,"TV Comedies, TV Dramas, TV Mysteries"
80102952,Movie,Quincy,United States,21/09/2018,2018,TV-MA,124 min,"Documentaries, Music & Musicals"
80214464,Movie,Rafinha Bastos: Ultimatum,Brazil,21/09/2018,2018,TV-MA,63 min,Stand-Up Comedy
80157073,TV Show,The Good Cop,United States,21/09/2018,2018,TV-PG,1 Season,"Crime TV Shows, TV Comedies, TV Dramas"
80243600,Movie,Between Two Ferns: The Movie,United States,20/09/2019,2019,TV-MA,83 min,Comedies
81020513,TV Show,Criminal: France,,20/09/2019,2019,TV-MA,1 Season,"Crime TV Shows, International TV Shows, TV Dramas"
81020518,TV Show,Criminal: Germany,,20/09/2019,2019,TV-MA,1 Season,"Crime TV Shows, International TV Shows, TV Dramas"
81020523,TV Show,Criminal: Spain,,20/09/2019,2019,TV-MA,1 Season,"Crime TV Shows, International TV Shows, Spanish-Language TV Shows"
80216172,TV Show,Criminal: UK,"United Kingdom, France, Germany, Spain",20/09/2019,2019,TV-MA,1 Season,"British TV Shows, Crime TV Shows, International TV Shows"
81122669,Movie,Daddy Issues,United States,20/09/2019,2019,TV-MA,82 min,"Dramas, Independent Movies, LGBTQ Movies"
80184771,TV Show,Inside Bill's Brain: Decoding Bill Gates,United States,20/09/2019,2019,TV-14,1 Season,"Docuseries, Science & Nature TV"
81000389,TV Show,The Hockey Girls,Spain,20/09/2019,2019,TV-MA,1 Season,"International TV Shows, TV Comedies, TV Dramas"
81132439,Movie,Travel Mates 2,Turkey,20/09/2019,2018,TV-14,111 min,"Comedies, International Movies"
81035117,Movie,True: Tricky Treat Day,Canada,20/09/2019,2019,TV-Y,24 min,Children & Family Movies
80244627,TV Show,Two Sentence Horror Stories,United States,20/09/2019,2019,TV-14,1 Season,"TV Horror, Teen TV Shows"
80150502,Movie,Mad World,Hong Kong,20/09/2018,2016,TV-MA,102 min,"Dramas, International Movies"
80189183,TV Show,Mobile Suit Gundam UC,Japan,20/09/2018,2014,TV-14,1 Season,"Anime Series, International TV Shows"
80997866,Movie,The Bund,Hong Kong,20/09/2018,1983,TV-14,103 min,"Action & Adventure, Dramas, International Movies"
80119815,Movie,The First Line,"United States, Greece, United Kingdom",20/09/2016,2014,TV-14,87 min,"Dramas, Independent Movies"
80993149,Movie,Maynard,United States,02/09/2018,2017,TV-PG,100 min,Documentaries
80224294,TV Show,Monkey Twins,Thailand,02/09/2018,2018,TV-MA,1 Season,"Crime TV Shows, International TV Shows, TV Action & Adventure"
80203776,Movie,Bitcoin Heist,Vietnam,02/09/2017,2016,TV-14,116 min,"Action & Adventure, Comedies, International Movies"
80143797,Movie,I Am Not Madame Bovary,China,02/09/2017,2016,TV-14,139 min,"Comedies, Dramas, International Movies"
80161931,Movie,Vincent N Roxxy,United States,02/09/2017,2016,R,101 min,"Dramas, Thrillers"
80128096,TV Show,Chef's Table: France,,02/09/2016,2016,TV-14,1 Season,Docuseries
80057610,TV Show,Kulipari: An Army of Frogs,United States,02/09/2016,2016,TV-Y7-FV,1 Season,Kids' TV
80017275,Movie,Miss Julie,"Norway, United Kingdom, France, Ireland",02/09/2015,2014,PG-13,130 min,"Dramas, International Movies"
81107545,Movie,Kabir Singh,India,19/09/2019,2019,TV-MA,171 min,"Dramas, International Movies, Romantic Movies"
70118953,Movie,Océans,"France, Switzerland, Spain, United States, United Arab Emirates",19/09/2019,2009,G,84 min,"Documentaries, International Movies"
80190449,Movie,The Endless,United States,19/09/2018,2017,TV-MA,112 min,"Independent Movies, Sci-Fi & Fantasy, Thrillers"
70259208,TV Show,Transformers: Rescue Bots,"Canada, United States",19/09/2018,2016,TV-Y7,1 Season,Kids' TV
80163156,Movie,Jerry Before Seinfeld,United States,19/09/2017,2017,TV-14,62 min,Stand-Up Comedy
80176878,TV Show,Manhunt,United States,19/09/2017,2017,TV-14,1 Season,"Crime TV Shows, TV Dramas, TV Mysteries"
80131281,Movie,"Karol Modzelewski, Łukasz „Lotek” Lodkowski No Offense",,19/09/2016,2016,TV-MA,65 min,Stand-Up Comedy
80131374,Movie,"Katarzyna Piasecka, Rafał Pacześ Seriously Funny",,19/09/2016,2016,TV-MA,65 min,Stand-Up Comedy
80131436,Movie,"Mariusz Kałamaga, Karol Kopiec, Wiolka Walaszczyk Hilarious Trio",,19/09/2016,2016,TV-MA,69 min,Stand-Up Comedy
80131376,Movie,"Rafał Banaś, Michał Leja Laugh out Loud",,19/09/2016,2016,TV-MA,64 min,Stand-Up Comedy
80131435,Movie,The Best of Rafał Rutkowski Olka Szczęśniak,,19/09/2016,2016,TV-MA,63 min,Stand-Up Comedy
80131375,Movie,"Tomasz Jachimek, Jacek Stramik Laugh at Live",,19/09/2016,2016,TV-MA,63 min,Stand-Up Comedy
80149143,Movie,Come and Find Me,"Canada, United States, United Kingdom",18/09/2019,2016,R,112 min,"Dramas, Thrillers"
81144925,TV Show,When the Camellia Blooms,South Korea,18/09/2019,2019,TV-14,1 Season,"International TV Shows, Korean TV Shows, Romantic TV Shows"
80987075,Movie,Class Rank,United States,18/09/2018,2018,TV-14,103 min,Comedies
80192815,Movie,Barbie Dolphin Magic,United States,18/09/2017,2017,TV-G,64 min,Children & Family Movies
80136785,TV Show,Forget Me Not,United Kingdom,18/09/2017,2011,TV-MA,1 Season,"International TV Shows, TV Dramas"
80135278,TV Show,The Beat,,18/09/2017,2012,TV-PG,1 Season,"International TV Shows, TV Dramas"
80136452,TV Show,Timeless Season,,18/09/2017,2009,TV-14,1 Season,"International TV Shows, TV Dramas"
80066798,Movie,Keith Richards: Under the Influence,United States,18/09/2015,2015,TV-PG,82 min,"Documentaries, Music & Musicals"
81147293,Movie,A Haunting at Silver Falls: The Return,United States,17/09/2019,2019,TV-14,80 min,"Horror Movies, Independent Movies"
70178604,TV Show,Ancient Aliens,United States,17/09/2019,2010,TV-PG,1 Season,"Docuseries, Science & Nature TV"
80991316,Movie,Avengement,United Kingdom,17/09/2019,2019,TV-MA,88 min,Action & Adventure
80190588,Movie,Clive Davis: The Soundtrack of Our Lives,United States,17/09/2019,2017,TV-14,124 min,"Documentaries, Music & Musicals"
70124316,Movie,Five Elements Ninjas,Hong Kong,17/09/2019,1982,R,104 min,"Action & Adventure, International Movies"
70229037,Movie,Sebastian Maniscalco: What's Wrong with People?,United States,17/09/2019,2012,TV-14,76 min,Stand-Up Comedy
80219119,TV Show,The Last Kids on Earth,United States,17/09/2019,2019,TV-Y7-FV,1 Season,"Kids' TV, TV Comedies"
80037280,Movie,The Witch,"United Kingdom, Canada, United States",17/09/2018,2015,R,92 min,"Horror Movies, Independent Movies"
80165072,TV Show,Click for Murder,United Kingdom,17/09/2017,2017,TV-14,1 Season,"British TV Shows, Crime TV Shows, Docuseries"
80058248,Movie,I Am Wrath,United States,16/09/2019,2016,R,91 min,"Action & Adventure, Dramas"
70307661,Movie,"As Above, So Below",United States,16/09/2018,2014,R,93 min,"Horror Movies, Thrillers"
70117312,Movie,Scott Pilgrim vs. the World,"United States, United Kingdom, Canada, Japan",16/09/2018,2010,PG-13,112 min,"Action & Adventure, Comedies, Cult Movies"
80092885,Movie,ARQ,"Canada, United States",16/09/2016,2016,TV-MA,89 min,"International Movies, Sci-Fi & Fantasy, Thrillers"
80108371,Movie,Cedric the Entertainer: Live from the Ville,United States,16/09/2016,2016,TV-MA,60 min,Stand-Up Comedy
70129452,Movie,Louis C.K.: Hilarious,United States,16/09/2016,2010,,84 min,Movies
80045805,Movie,Raiders!: The Story of the Greatest Fan Film Ever Made,United States,16/09/2016,2015,NR,93 min,Documentaries
80101827,Movie,The White Helmets,United Kingdom,16/09/2016,2016,TV-14,41 min,Documentaries
70251519,TV Show,America's Book of Secrets,United States,15/09/2019,2014,TV-14,1 Season,Docuseries
81174992,TV Show,Bakugan: Battle Planet,"Japan, Canada, South Korea",15/09/2019,2018,TV-PG,1 Season,"Anime Series, Kids' TV"
81044365,TV Show,Cold Case Files,United States,15/09/2019,2017,TV-14,1 Season,"Crime TV Shows, Docuseries"
81030342,Movie,Los Tigres del Norte at Folsom Prison,United States,15/09/2019,2019,TV-PG,64 min,"Documentaries, International Movies, Music & Musicals"
70143865,TV Show,Pawn Stars,United States,15/09/2019,2010,TV-PG,1 Season,Reality TV
70054723,Movie,Steal a Pencil for Me,United States,15/09/2019,2006,TV-14,94 min,Documentaries
81069393,TV Show,Surviving R. Kelly,United States,15/09/2019,2019,TV-MA,1 Season,Docuseries
80012550,TV Show,The Curse of Oak Island,United States,15/09/2019,2014,TV-PG,1 Season,Docuseries
81131761,Movie,The Outsider,United States,15/09/2019,2019,TV-MA,86 min,Movies
81176196,TV Show,The Rap Game,United States,15/09/2019,2016,TV-14,1 Season,Reality TV
70143831,TV Show,The Universe,United States,15/09/2019,2009,TV-PG,1 Season,"Docuseries, Science & Nature TV"
81003648,TV Show,Al Hayba,Lebanon,15/09/2018,2017,TV-14,1 Season,"Crime TV Shows, International TV Shows, TV Dramas"
81016326,Movie,Arisan 2,Indonesia,15/09/2018,2011,TV-14,113 min,"Comedies, Dramas, International Movies"
80241102,TV Show,Cabins in the Wild with Dick Strawbridge,United Kingdom,15/09/2018,2017,TV-PG,1 Season,"British TV Shows, International TV Shows, Reality TV"
80227777,Movie,Cardboard Gangsters,Ireland,15/09/2018,2016,TV-MA,92 min,"Dramas, International Movies"
81018233,Movie,Eeda,India,15/09/2018,2018,TV-14,153 min,"Dramas, International Movies, Romantic Movies"
