show_id,type,title,country,date_added,release_year,rating,duration,listed_in
80092409,Movie,This Was Tomorrow,Belgium,15/12/2015,2015,NR,77 min,"Documentaries, International Movies, Music & Musicals"
81042804,TV Show,Hymn of Death,South Korea,14/12/2018,2018,TV-14,1 Season,"International TV Shows, Korean TV Shows, Romantic TV Shows"
80240817,TV Show,Inside the Real Narcos,,14/12/2018,2018,TV-MA,1 Season,"British TV Shows, Crime TV Shows, Docuseries"
80240715,Movie,ROMA,"Mexico, United States",14/12/2018,2018,R,135 min,"Dramas, Independent Movies, International Movies"
80222301,Movie,Samson,"South Africa, United States",14/12/2018,2018,PG-13,109 min,"Action & Adventure, Dramas, Faith & Spirituality"
80207046,TV Show,Sunderland 'Til I Die,United Kingdom,14/12/2018,2018,TV-MA,1 Season,"British TV Shows, Docuseries, International TV Shows"
80216124,TV Show,The Fix,United States,14/12/2018,2018,TV-MA,1 Season,TV Comedies
80187030,TV Show,The Innocent Man,United States,14/12/2018,2018,TV-MA,1 Season,"Crime TV Shows, Docuseries"
80191239,TV Show,Tidelands,Australia,14/12/2018,2018,TV-MA,1 Season,"Crime TV Shows, International TV Shows, TV Dramas"
80104182,Movie,At All Costs,United States,14/12/2016,2016,TV-MA,81 min,"Documentaries, Sports Movies"
81001887,Movie,6 Underground,United States,13/12/2019,2019,R,129 min,"Action & Adventure, Dramas"
81172747,Movie,A Trip to Jamaica,Nigeria,13/12/2019,2016,TV-MA,99 min,"Comedies, International Movies"
81172757,Movie,My Wife and I,Nigeria,13/12/2019,2017,TV-MA,100 min,"Comedies, International Movies, Romantic Movies"
81172903,Movie,Okafor's Law,Nigeria,13/12/2019,2016,TV-MA,110 min,"Comedies, International Movies, Romantic Movies"
81172904,Movie,Seven and a half dates,,13/12/2019,2018,TV-14,107 min,"Dramas, International Movies, Romantic Movies"
70243446,Movie,Silent Hill: Revelation,"Canada, France, United States",13/12/2019,2012,R,94 min,Horror Movies
81210770,Movie,The 9th Precinct,Taiwan,13/12/2019,2019,TV-14,95 min,"International Movies, Thrillers"
81172864,Movie,Zero Hour,,13/12/2019,2018,TV-14,89 min,"International Movies, Thrillers"
80091880,TV Show,Tokyo Trial,"Canada, Japan, Netherlands",13/12/2016,2017,TV-14,1 Season,"International TV Shows, TV Dramas"
81060232,Movie,Jack Whitehall: Christmas with My Father,United Kingdom,12/12/2019,2019,TV-MA,65 min,Stand-Up Comedy
80996957,TV Show,Back Street Girls -GOKUDOLS-,Japan,12/12/2018,2018,TV-MA,1 Season,"Anime Series, International TV Shows"
81010212,Movie,"Out of Many, One",United States,12/12/2018,2018,TV-PG,35 min,Documentaries
80158871,Movie,Judd Apatow: The Return,United States,12/12/2017,2017,TV-MA,70 min,Stand-Up Comedy
80139397,Movie,The Trip to Spain,United Kingdom,12/12/2017,2016,TV-MA,108 min,Comedies
80107019,Movie,The Unknown Girl,"Belgium, France",12/12/2017,2016,TV-MA,106 min,"Dramas, International Movies"
80191835,Movie,Viceroy's House,"United Kingdom, India, Sweden",12/12/2017,2017,NR,106 min,Dramas
70267802,Movie,Blackfish,United States,12/12/2016,2013,PG-13,83 min,Documentaries
80124728,Movie,Ricardo O'Farrill: Abrazo navideño,Mexico,12/12/2016,2016,TV-MA,31 min,Stand-Up Comedy
80020772,Movie,Get Santa,"United Kingdom, United States",12/12/2014,2014,PG,103 min,"Children & Family Movies, Comedies"
70290567,Movie,The Short Game,United States,12/12/2013,2013,PG,100 min,"Children & Family Movies, Documentaries, Sports Movies"
81037373,Movie,The Sky Is Pink,"India, United Kingdom, Canada, United States",11/12/2019,2019,TV-14,143 min,"Dramas, International Movies"
80065754,Movie,Standoff,Canada,11/12/2018,2015,R,86 min,Action & Adventure
80995991,Movie,Vir Das: Losing It,,11/12/2018,2018,TV-MA,68 min,Stand-Up Comedy
80180711,TV Show,Dawai Asmara,,11/12/2017,2016,TV-14,1 Season,"International TV Shows, TV Dramas"
80205065,Movie,Red Christmas,Australia,11/12/2017,2016,TV-MA,81 min,Horror Movies
80194612,Movie,The Hatred,United States,11/12/2017,2017,R,94 min,Horror Movies
80104420,Movie,Asperger's Are Us,United States,11/12/2016,2016,TV-14,83 min,Documentaries
80039517,Movie,The Ridiculous 6,United States,11/12/2015,2015,TV-14,120 min,"Action & Adventure, Comedies"
81035888,Movie,Good and Prosperous,Egypt,10/12/2019,2017,TV-14,101 min,"Comedies, International Movies"
81036542,Movie,Michelle Wolf: Joke Show,United States,10/12/2019,2019,TV-MA,60 min,Stand-Up Comedy
81001121,Movie,Gehenna: Where Death Lives,"Japan, United States",10/12/2018,2016,TV-MA,107 min,"Horror Movies, Thrillers"
80144453,Movie,Goldstone,Australia,10/12/2018,2016,R,110 min,Thrillers
81009829,Movie,Susanne Bartsch: On Top,United States,10/12/2018,2017,TV-MA,86 min,"Documentaries, LGBTQ Movies"
81025391,TV Show,Trotsky,Russia,10/12/2018,2017,TV-MA,1 Season,"International TV Shows, TV Dramas"
80131415,TV Show,Nobel,Norway,10/12/2016,2016,R,1 Season,"International TV Shows, TV Dramas, TV Thrillers"
80132410,Movie,Sons of Ben,United States,10/12/2016,2016,NR,73 min,"Documentaries, Sports Movies"
81148811,Movie,A Cinderella Story: Christmas Wish,United States,01/12/2019,2019,PG,86 min,"Children & Family Movies, Comedies, Music & Musicals"
18066997,Movie,A Night at the Roxbury,United States,01/12/2019,1998,PG-13,82 min,"Comedies, Cult Movies"
60023608,Movie,Austin Powers in Goldmember,United States,01/12/2019,2002,PG-13,94 min,"Action & Adventure, Comedies"
1153656,Movie,Austin Powers: International Man of Mystery,United States,01/12/2019,1997,PG-13,90 min,Comedies
21302357,Movie,Austin Powers: The Spy Who Shagged Me,United States,01/12/2019,1999,PG-13,95 min,"Action & Adventure, Comedies, Sci-Fi & Fantasy"
81217745,Movie,Baby Dolls,India,01/12/2019,2019,TV-14,127 min,"Comedies, International Movies, Romantic Movies"
80011622,Movie,Cut Bank,United States,01/12/2019,2014,R,93 min,"Dramas, Thrillers"
81165325,Movie,Dead Kids,Philippines,01/12/2019,2019,TV-MA,94 min,"Dramas, International Movies, Thrillers"
81217746,Movie,High End Yaariyan,India,01/12/2019,2019,TV-14,120 min,"Comedies, International Movies, Romantic Movies"
70023451,Movie,Hustle & Flow,United States,01/12/2019,2005,R,117 min,"Dramas, Independent Movies, Music & Musicals"
80188823,Movie,Iron Fists and Kung-Fu Kicks,Australia,01/12/2019,2019,TV-MA,108 min,"Documentaries, International Movies"
80182479,Movie,Jindua,India,01/12/2019,2017,TV-14,135 min,"Dramas, International Movies, Romantic Movies"
81217743,Movie,Lakeeran,India,01/12/2019,2016,TV-14,111 min,"Dramas, International Movies, Romantic Movies"
81217741,Movie,Mahi NRI,United Kingdom,01/12/2019,2017,TV-14,134 min,"Comedies, Dramas, International Movies"
60024161,Movie,Martin Lawrence Live: Runteldat,United States,01/12/2019,2002,R,104 min,Stand-Up Comedy
81151079,TV Show,Morphle,Netherlands,01/12/2019,2011,TV-Y,1 Season,"British TV Shows, Kids' TV"
873159,Movie,Primal Fear,United States,01/12/2019,1996,R,131 min,"Dramas, Thrillers"
81217747,Movie,Qismat,India,01/12/2019,2018,TV-PG,137 min,"Dramas, International Movies, Romantic Movies"
70229213,Movie,Searching for Sugar Man,"Sweden, United Kingdom, Finland",01/12/2019,2012,PG-13,86 min,"Documentaries, International Movies, Music & Musicals"
81194523,TV Show,Suits,South Korea,01/12/2019,2018,TV-14,1 Season,"International TV Shows, Korean TV Shows, TV Dramas"
80191294,Movie,Sweet Virginia,"United States, Canada",01/12/2019,2017,R,93 min,"Dramas, Independent Movies, Thrillers"
81184705,Movie,Tee Shot: Ariya Jutanugarn,,01/12/2019,2019,TV-14,103 min,"Children & Family Movies, Dramas, International Movies"
70021640,Movie,The Adventures of Sharkboy and Lavagirl,United States,01/12/2019,2005,PG,93 min,Children & Family Movies
80202859,TV Show,The Bachelor,,01/12/2019,2009,TV-14,1 Season,"Reality TV, Romantic TV Shows"
70044689,Movie,The Departed,United States,01/12/2019,2006,R,151 min,"Dramas, Thrillers"
80208793,Movie,The Tribes of Palos Verdes,United States,01/12/2019,2017,R,104 min,"Dramas, Independent Movies, Sports Movies"
81217742,Movie,Thug Life,India,01/12/2019,2017,TV-14,133 min,"Comedies, Dramas, International Movies"
81169158,Movie,Wandering Stars,France,01/12/2019,2019,TV-MA,95 min,"Documentaries, International Movies, Music & Musicals"
81149202,Movie,Why Me?,"Romania, Bulgaria, Hungary",01/12/2019,2015,TV-MA,126 min,"Dramas, International Movies, Thrillers"
80212701,TV Show,21 Sarfarosh: Saragarhi 1897,India,01/12/2018,2018,TV-14,1 Season,"International TV Shows, TV Dramas"
70216819,Movie,A Beautiful Life,"China, Hong Kong",01/12/2018,2011,TV-14,122 min,"Dramas, International Movies, Romantic Movies"
70124651,Movie,Accident,Hong Kong,01/12/2018,2009,TV-MA,87 min,"International Movies, Thrillers"
81013509,Movie,"Ayotzinapa, el paso de la tortuga",Mexico,01/12/2018,2018,TV-14,73 min,"Documentaries, International Movies"
81002685,Movie,Battle,"Norway, Denmark, Netherlands, Sweden",01/12/2018,2018,TV-MA,98 min,"Dramas, International Movies, Romantic Movies"
70204955,TV Show,Black Butler,Japan,01/12/2018,2010,TV-14,1 Season,"Anime Series, International TV Shows"
70285697,Movie,Blind Detective,"Hong Kong, China",01/12/2018,2013,TV-MA,130 min,"Action & Adventure, Comedies, International Movies"
81018536,Movie,Bobby Robson: More Than a Manager,United Kingdom,01/12/2018,2018,TV-14,99 min,"Documentaries, International Movies, Sports Movies"
81030201,Movie,Break Up 100,Hong Kong,01/12/2018,2014,TV-14,105 min,"Comedies, International Movies, Romantic Movies"
81024726,Movie,Chal Bhaag,India,01/12/2018,2014,TV-14,110 min,"Comedies, Dramas, International Movies"
81015153,Movie,Crossroads: One Two Jaga,Malaysia,01/12/2018,2018,TV-14,81 min,"Dramas, International Movies"
81030198,Movie,Don't Go Breaking My Heart,Hong Kong,01/12/2018,2011,TV-PG,115 min,"Comedies, International Movies, Romantic Movies"
80017265,Movie,Don't Go Breaking My Heart 2,"Hong Kong, China",01/12/2018,2014,TV-14,113 min,"Comedies, International Movies, Romantic Movies"
81024716,Movie,Faraar,Australia,01/12/2018,2015,TV-14,146 min,"Action & Adventure, Dramas, International Movies"
81028939,TV Show,Haunted House,,01/12/2018,2017,TV-Y7-FV,1 Season,"Kids' TV, Korean TV Shows"
80106306,Movie,Helios,"Hong Kong, China, United States",01/12/2018,2015,TV-MA,118 min,"Action & Adventure, International Movies"
60034549,Movie,Hellboy,United States,01/12/2018,2004,PG-13,122 min,"Action & Adventure, Cult Movies, Sci-Fi & Fantasy"
80135353,Movie,Line Walker,"China, Hong Kong",01/12/2018,2016,TV-MA,109 min,"Action & Adventure, Dramas, International Movies"
80229852,TV Show,Little Singham,,01/12/2018,2019,TV-Y7,1 Season,"Kids' TV, TV Comedies"
80995077,Movie,Little Singham aur Kaal ka Mahajaal,,01/12/2018,2018,TV-Y7-FV,68 min,"Children & Family Movies, Comedies"
70126809,Movie,Look for a Star,Hong Kong,01/12/2018,2009,TV-PG,117 min,"Comedies, International Movies, Romantic Movies"
80995044,TV Show,Man vs Wild with Sunny Leone,,01/12/2018,2018,TV-PG,1 Season,"International TV Shows, Reality TV, TV Action & Adventure"
81031038,Movie,Oddbods: The Festive Menace,,01/12/2018,2018,TV-Y,23 min,Movies
80127645,Movie,Once a Gangster,Hong Kong,01/12/2018,2010,TV-MA,95 min,"Action & Adventure, Comedies, International Movies"
80187471,Movie,Power Paandi,India,01/12/2018,2017,TV-14,124 min,"Dramas, International Movies"
81024500,Movie,Roll With Me,United States,01/12/2018,2017,TV-MA,90 min,"Documentaries, Sports Movies"
81030200,Movie,SDU: Sex Duties Unit,Hong Kong,01/12/2018,2013,TV-MA,96 min,"Comedies, International Movies"
81030197,Movie,Set Off,China,01/12/2018,2008,TV-MA,96 min,"Dramas, International Movies"
70104313,Movie,Seven Pounds,United States,01/12/2018,2008,PG-13,123 min,"Dramas, Romantic Movies"
80166319,Movie,The Little Mermaid,United States,01/12/2018,2018,PG,85 min,"Children & Family Movies, Dramas"
80158854,Movie,A StoryBots Christmas,United States,01/12/2017,2017,TV-Y,26 min,Movies
80208746,TV Show,Atomic Puppet,"Canada, France",01/12/2017,2016,TV-Y7-FV,1 Season,"Crime TV Shows, Kids' TV, TV Comedies"
80203781,Movie,Bhouri,India,01/12/2017,2017,TV-14,123 min,"Dramas, Independent Movies, International Movies"
80204929,TV Show,Cheapest Weddings,Australia,01/12/2017,2016,TV-14,1 Season,"International TV Shows, Reality TV"
80180601,TV Show,Dhia Sofea,Malaysia,01/12/2017,2015,TV-14,1 Season,"International TV Shows, TV Dramas"
80221317,Movie,Diana: In Her Own Words,United Kingdom,01/12/2017,2017,TV-PG,113 min,"Documentaries, International Movies"
80178882,Movie,Dream Boat,Germany,01/12/2017,2017,TV-MA,92 min,"Documentaries, International Movies, LGBTQ Movies"
80191081,Movie,DreamWorks Home: For the Holidays,United States,01/12/2017,2017,TV-Y7,46 min,"Children & Family Movies, Comedies, Music & Musicals"
80203792,Movie,Eh Janam Tumhare Lekhe,India,01/12/2017,2015,TV-14,124 min,"Dramas, International Movies"
80191930,Movie,Forbidden Games: The Justin Fashanu Story,United Kingdom,01/12/2017,2017,TV-14,81 min,"Documentaries, International Movies, LGBTQ Movies"
70170181,Movie,Hisss,"India, United States",01/12/2017,2010,TV-MA,97 min,"Horror Movies, International Movies, Thrillers"
80175348,TV Show,Kantaro: The Sweet Tooth Salaryman,Japan,01/12/2017,2017,TV-PG,1 Season,"International TV Shows, TV Comedies"
80173001,Movie,Monster Island,"India, Mexico",01/12/2017,2017,TV-Y7-FV,81 min,Children & Family Movies
80171247,Movie,My Happy Family,"Georgia, Germany, France",01/12/2017,2017,TV-14,119 min,"Dramas, Independent Movies, International Movies"
70286808,TV Show,Oggy and the Cockroaches,France,01/12/2017,2017,TV-Y7,1 Season,"Kids' TV, TV Comedies"
80180651,TV Show,Padamu Aku Bersujud,,01/12/2017,2015,TV-PG,1 Season,"International TV Shows, Romantic TV Shows, TV Dramas"
70135647,Movie,Playing for Time,United States,01/12/2017,1980,TV-14,149 min,Dramas
80201828,Movie,Prague,"India, Switzerland",01/12/2017,2013,TV-MA,106 min,"Dramas, Independent Movies, International Movies"
80203787,Movie,Sardaar ji,Canada,01/12/2017,2015,TV-14,140 min,"Comedies, International Movies, Music & Musicals"
70236586,Movie,Tezz,"United Kingdom, India",01/12/2017,2012,TV-MA,121 min,"Action & Adventure, International Movies, Music & Musicals"
80216237,TV Show,The Jaime Maussan Show,United States,01/12/2017,2010,TV-PG,1 Season,"Docuseries, International TV Shows, Spanish-Language TV Shows"
80173271,Movie,The Legend of 420,United States,01/12/2017,2017,TV-MA,87 min,Documentaries
80191513,Movie,The Worthy,"United Arab Emirates, Romania",01/12/2017,2016,TV-MA,99 min,"International Movies, Sci-Fi & Fantasy, Thrillers"
80176212,Movie,Voyeur,United States,01/12/2017,2017,TV-MA,96 min,Documentaries
70286809,TV Show,Zig & Sharko,France,01/12/2017,2016,TV-Y,1 Season,Kids' TV
80147908,Movie,#Rucker50,United States,01/12/2016,2016,TV-PG,56 min,"Documentaries, Sports Movies"
80113785,Movie,1000 Rupee Note,India,01/12/2016,2014,NR,89 min,"Dramas, International Movies"
80152091,Movie,Across Grace Alley,United States,01/12/2016,2013,TV-PG,24 min,Dramas
80118982,Movie,Asu Mare 2,Peru,01/12/2016,2015,NR,100 min,"Comedies, International Movies"
80134109,TV Show,Back to 1989,Taiwan,01/12/2016,2016,TV-14,1 Season,"International TV Shows, Romantic TV Shows, TV Comedies"
80133781,TV Show,Bromance,Taiwan,01/12/2016,2015,TV-14,1 Season,"International TV Shows, Romantic TV Shows, TV Comedies"
80147811,TV Show,Chill with Bob Ross,,01/12/2016,1994,TV-G,1 Season,TV Shows
80039789,TV Show,Gargantia on the Verdurous Planet,Japan,01/12/2016,2013,,1 Season,"Anime Series, International TV Shows"
80149139,Movie,Interrogation,India,01/12/2016,2015,TV-MA,116 min,"Dramas, International Movies, Thrillers"
80040118,TV Show,K,Japan,01/12/2016,2012,TV-MA,1 Season,"Anime Series, Crime TV Shows, International TV Shows"
80134797,TV Show,Merlí,Spain,01/12/2016,2015,TV-MA,1 Season,"International TV Shows, TV Dramas, Teen TV Shows"
80114915,Movie,Natural Selection,United States,01/12/2016,2015,R,101 min,"Dramas, Independent Movies"
80040089,TV Show,Nura: Rise of the Yokai Clan: Demon Capital,Japan,01/12/2016,2011,TV-MA,1 Season,"Anime Series, Crime TV Shows"
80104240,Movie,Rainbow Time,United States,01/12/2016,2016,NR,92 min,"Comedies, Dramas, Independent Movies"
80134078,TV Show,Refresh Man,Taiwan,01/12/2016,2016,TV-PG,1 Season,"International TV Shows, Romantic TV Shows, TV Comedies"
907090,Movie,Richard Pryor: Live in Concert,United States,01/12/2016,1979,TV-MA,79 min,Stand-Up Comedy
80135563,Movie,Tellur Aliens,"United States, Kazakhstan",01/12/2016,2016,TV-Y7,67 min,Children & Family Movies
80113894,TV Show,The Irish Mob,,01/12/2016,2008,TV-MA,1 Season,"Crime TV Shows, Docuseries"
80149282,Movie,The Violin Player,India,01/12/2016,2016,NR,72 min,"Dramas, Independent Movies, International Movies"
80154176,Movie,Yo-Kai Watch: The Movie,"Japan, United States",01/12/2016,2016,TV-Y7,96 min,"Anime Features, Children & Family Movies"
80067618,TV Show,Atelier,Japan,01/12/2015,2015,TV-PG,1 Season,"International TV Shows, TV Dramas"
80073100,Movie,My Little Pony Equestria Girls: Friendship Games,United States,01/12/2015,2015,TV-Y,72 min,"Children & Family Movies, Comedies"
80066806,Movie,Tyke Elephant Outlaw,Australia,01/12/2015,2015,TV-14,78 min,"Documentaries, International Movies"
70253397,Movie,Kung Fu Panda: Holiday,United States,01/12/2012,2010,TV-PG,26 min,"Children & Family Movies, Comedies"
81156592,Movie,Colin Quinn: Red State Blue State,,09/08/2019,2019,TV-14,66 min,Stand-Up Comedy
81074367,Movie,Jaoon Kahan Bata Ae Dil,India,09/08/2019,2018,TV-MA,107 min,"Dramas, Independent Movies, International Movies"
81091977,Movie,Rocko's Modern Life: Static Cling,United States,09/08/2019,2019,TV-Y7,46 min,"Children & Family Movies, Comedies, LGBTQ Movies"
80217315,TV Show,Sintonia,Brazil,09/08/2019,2019,TV-MA,1 Season,"Crime TV Shows, International TV Shows, TV Dramas"
80063867,TV Show,The Family,,09/08/2019,2019,TV-14,1 Season,Docuseries
80243216,TV Show,The InBESTigators,Australia,09/08/2019,2019,TV-G,1 Season,"Kids' TV, TV Comedies"
81016914,TV Show,Tiny House Nation,United States,09/08/2019,2019,TV-PG,1 Season,Reality TV
81153372,Movie,Westside vs. the World,,09/08/2019,2019,TV-MA,96 min,"Documentaries, Sports Movies"
80245357,Movie,Perdida,"Argentina, Spain",09/08/2018,2018,TV-MA,104 min,"Dramas, International Movies, Thrillers"
80222042,Movie,The Most Unknown,United States,09/08/2018,2018,TV-PG,92 min,Documentaries
80128691,Movie,Black Site Delta,United States,09/08/2017,2017,TV-MA,88 min,Action & Adventure
80178427,TV Show,Bad Guys,South Korea,08/08/2019,2014,TV-MA,1 Season,"Crime TV Shows, International TV Shows, Korean TV Shows"
81079322,TV Show,Dollar,Lebanon,08/08/2019,2019,TV-MA,1 Season,"International TV Shows, TV Dramas"
70183165,Movie,Judy Moody and the Not Bummer Summer,United States,08/08/2019,2011,PG,91 min,"Children & Family Movies, Comedies"
80183878,TV Show,Let's Eat 2,"Malaysia, Singapore, Hong Kong",08/08/2019,2015,TV-14,1 Season,"International TV Shows, Korean TV Shows, Romantic TV Shows"
80177986,TV Show,Let’s Eat,South Korea,08/08/2019,2013,TV-14,1 Season,"International TV Shows, Korean TV Shows, Romantic TV Shows"
80165295,TV Show,Misaeng,South Korea,08/08/2019,2014,TV-14,1 Season,"International TV Shows, Korean TV Shows, TV Dramas"
80178404,TV Show,Oh My Ghost,South Korea,08/08/2019,2015,TV-14,1 Season,"International TV Shows, Korean TV Shows, Romantic TV Shows"
80165487,TV Show,Reply 1994,South Korea,08/08/2019,2014,TV-14,1 Season,"International TV Shows, Korean TV Shows, Romantic TV Shows"
70297144,TV Show,Reply 1997,South Korea,08/08/2019,2012,TV-14,1 Season,"International TV Shows, Korean TV Shows, Romantic TV Shows"
81087761,Movie,Roll Red Roll,United States,08/08/2019,2018,TV-MA,80 min,Documentaries
81065902,Movie,St. Agatha,United States,08/08/2019,2018,TV-MA,103 min,"Horror Movies, Independent Movies"
80239462,TV Show,The Naked Director,Japan,08/08/2019,2019,TV-MA,1 Season,"International TV Shows, TV Dramas"
80230293,TV Show,Wu Assassins,United States,08/08/2019,2019,TV-MA,1 Season,"TV Action & Adventure, TV Sci-Fi & Fantasy"
81000207,TV Show,Enemigo íntimo,,08/08/2018,2018,TV-MA,1 Season,"Crime TV Shows, Spanish-Language TV Shows, TV Dramas"
80998058,TV Show,Pretty Man,,08/08/2018,2018,TV-14,1 Season,"International TV Shows, Romantic TV Shows, TV Dramas"
80195838,Movie,Denis Leary: No Cure For Cancer,United States,08/08/2017,1992,R,62 min,Stand-Up Comedy
81112446,Movie,Badla,India,07/08/2019,2019,TV-14,117 min,"International Movies, Thrillers"
81088318,Movie,The Pursuit,United States,07/08/2019,2019,TV-14,76 min,Documentaries
80080617,Movie,Theo Von: No Offense,United States,07/08/2019,2016,TV-MA,67 min,Stand-Up Comedy
80203996,Movie,Baahubali 2: The Conclusion (Hindi Version),India,07/08/2017,2017,TV-MA,165 min,"Action & Adventure, Dramas, International Movies"
80203998,Movie,Baahubali 2: The Conclusion (Malayalam Version),India,07/08/2017,2017,TV-MA,166 min,"Action & Adventure, Dramas, International Movies"
80203997,Movie,Baahubali 2: The Conclusion (Tamil Version),India,07/08/2017,2017,TV-MA,166 min,"Action & Adventure, Dramas, International Movies"
80204117,Movie,Baahubali: The Beginning (Hindi Version),India,07/08/2017,2015,TV-14,159 min,"Action & Adventure, Dramas, International Movies"
80204119,Movie,Baahubali: The Beginning (Malayalam Version),India,07/08/2017,2015,TV-14,160 min,"Action & Adventure, Dramas, International Movies"
80204118,Movie,Baahubali: The Beginning (Tamil Version),India,07/08/2017,2015,TV-14,159 min,"Action & Adventure, Dramas, International Movies"
80163368,Movie,Mission: Destroy Love,Malaysia,07/08/2017,2014,TV-14,93 min,"Comedies, International Movies, Romantic Movies"
80184868,Movie,The Black Room,United States,07/08/2017,2016,TV-MA,95 min,Horror Movies
80044888,Movie,Crazy Beautiful You,Philippines,06/08/2019,2015,TV-PG,114 min,"Comedies, Dramas, International Movies"
80050006,Movie,I'm Brent Morin,United States,06/08/2019,2015,TV-MA,67 min,Stand-Up Comedy
80002621,Movie,Jim Jefferies : BARE,United States,06/08/2019,2014,NR,77 min,Stand-Up Comedy
81145273,Movie,Professor Mack,United States,06/08/2019,2018,TV-MA,84 min,"Comedies, Romantic Movies"
81047680,Movie,Screwball,United States,06/08/2019,2018,TV-MA,105 min,"Documentaries, Sports Movies"
81001278,Movie,Sebastian Maniscalco: Why Would You Do That,United States,06/08/2019,2016,TV-MA,63 min,Stand-Up Comedy
80164979,Movie,Jake's Buccaneer Blast,,06/08/2017,2014,TV-Y,22 min,Movies
80165221,Movie,LEGO Marvel Super Heroes: Avengers Reassembled!,United States,06/08/2017,2015,TV-Y7,22 min,Children & Family Movies
81035838,Movie,Alarmoty in the Land of Fire,,05/08/2019,2017,TV-14,94 min,"Comedies, International Movies"
81035835,Movie,Detention Letter,Egypt,05/08/2019,2017,TV-14,99 min,"Action & Adventure, International Movies"
81143771,Movie,Enter the Anime,"United States, Japan",05/08/2019,2019,TV-MA,59 min,"Documentaries, International Movies"
80208295,Movie,No One Will Ever Know,Mexico,05/08/2019,2017,TV-MA,102 min,"Dramas, International Movies"
81000509,TV Show,On Children,Taiwan,05/08/2018,2018,TV-14,1 Season,"International TV Shows, TV Dramas, TV Mysteries"
80138681,Movie,Enter the Warriors Gate,"France, China, Canada",05/08/2017,2016,PG-13,105 min,"Action & Adventure, International Movies, Sci-Fi & Fantasy"
80167488,Movie,Lady Bloodfight,Hong Kong,05/08/2017,2016,R,101 min,Action & Adventure
80142222,Movie,Operation Mekong,"China, Hong Kong",05/08/2017,2016,TV-MA,124 min,"Action & Adventure, International Movies"
80156927,Movie,Sky on Fire,"China, Hong Kong",05/08/2017,2016,TV-MA,100 min,"Action & Adventure, International Movies"
80108759,Movie,David Cross: Making America Great Again!,United States,05/08/2016,2016,TV-MA,73 min,Stand-Up Comedy
80057578,Movie,The Little Prince,France,05/08/2016,2016,PG,107 min,Children & Family Movies
80018296,Movie,Yellowbird,"France, Belgium",05/08/2015,2014,PG,90 min,"Children & Family Movies, Comedies"
70303426,Movie,2 States,India,04/08/2018,2014,TV-PG,143 min,"Comedies, Dramas, International Movies"
80104648,Movie,Baaghi,India,04/08/2018,2016,TV-14,127 min,"Action & Adventure, International Movies"
80992995,Movie,Brij Mohan Amar Rahe,India,04/08/2018,2018,TV-MA,100 min,"Comedies, Dramas, International Movies"
80234491,Movie,Flavors of Youth: International Version,"China, Japan",04/08/2018,2018,TV-PG,74 min,"Anime Features, International Movies, Romantic Movies"
80124724,Movie,Alan Saldaña: Mi vida de pobre,Mexico,04/08/2017,2017,TV-MA,54 min,Stand-Up Comedy
80194184,TV Show,Dino Hunt,Canada,04/08/2017,2016,TV-G,1 Season,"Docuseries, Science & Nature TV"
80168079,Movie,Icarus,United States,04/08/2017,2017,TV-MA,121 min,"Documentaries, Sports Movies"
80155475,Movie,Message from the King,"United Kingdom, France, Belgium, United States",04/08/2017,2017,TV-MA,103 min,"Independent Movies, Thrillers"
80117800,TV Show,Wet Hot American Summer: Ten Years Later,United States,04/08/2017,2017,TV-MA,1 Season,TV Comedies
80226089,TV Show,Luo Bao Bei,"China, United Kingdom",31/08/2019,2018,TV-Y,1 Season,"British TV Shows, Kids' TV"
80150507,TV Show,Cathedral of the Sea,Spain,31/08/2018,2017,TV-MA,1 Season,"International TV Shows, Spanish-Language TV Shows, TV Dramas"
70254350,Movie,Chennai Express,India,31/08/2018,2013,TV-14,135 min,"Action & Adventure, Comedies, International Movies"
80185065,TV Show,Inside the Criminal Mind,"United States, Czech Republic",31/08/2018,2018,TV-MA,1 Season,"Crime TV Shows, Docuseries, International TV Shows"
70033611,Movie,"Justice, My Foot!",Hong Kong,31/08/2018,1992,TV-14,95 min,"Action & Adventure, Comedies, International Movies"
80191522,TV Show,Paradise PD,United States,31/08/2018,2018,TV-MA,1 Season,TV Comedies
80997863,Movie,Prince Charming,Hong Kong,31/08/2018,1984,TV-PG,93 min,"Comedies, International Movies, Romantic Movies"
